,datestr,city,state,shape,duration_description,start_dt,duration_secs,end_dt,location_name,lon,lat
1,3/16/17 23:30,Ruso,ND,light,30 seconds,2017-03-16 23:30:00,30.0,2017-03-16 23:30:30,ND Ruso,-100.9334809,47.8383369
3,3/16/17 21:41,Salem,OR,flash,3 seconds,2017-03-16 21:41:00,3.0,2017-03-16 21:41:03,OR Salem,-123.0350963,44.9428975
4,3/16/17 21:00,Auburn,WA,light,10 minutes,2017-03-16 21:00:00,600.0,2017-03-16 21:10:00,WA Auburn,-122.2284532,47.3073228
5,3/16/17 20:12,Tempe,AZ,other,50 minutes,2017-03-16 20:12:00,3000.0,2017-03-16 21:02:00,AZ Tempe,-111.9400054,33.4255104
6,3/16/17 19:35,Chandler,AZ,triangle,1 minute,2017-03-16 19:35:00,60.0,2017-03-16 19:36:00,AZ Chandler,-111.8412502,33.3061605
7,3/16/17 17:00,Las Cruces,NM,fireball,<1 hour,2017-03-16 17:00:00,3600.0,2017-03-16 18:00:00,NM Las Cruces,-106.7636538,32.3199396
8,3/16/17 06:35,Dallas (Lakewood area),TX,flash,15 seconds,2017-03-16 06:35:00,15.0,2017-03-16 06:35:15,TX Dallas (Lakewood area),-96.7428052,32.83455
9,3/16/17 00:00,Springfield,MO,disk,45 seconds,2017-03-16 00:00:00,45.0,2017-03-16 00:00:45,MO Springfield,-93.2922989,37.2089572
12,3/15/17 21:00,St. Augustine,FL,triangle,1 minute,2017-03-15 21:00:00,60.0,2017-03-15 21:01:00,FL St. Augustine,-81.3124341,29.9012437
13,3/15/17 20:35,Madison,WI,other,30 seconds,2017-03-15 20:35:00,30.0,2017-03-15 20:35:30,WI Madison,-89.4124875,43.076592
14,3/15/17 20:21,San Diego,CA,formation,13 minutes,2017-03-15 20:21:00,780.0,2017-03-15 20:34:00,CA San Diego,-117.1610838,32.715738
15,3/15/17 19:55,San Diego,CA,circle,2 minutes,2017-03-15 19:55:00,120.0,2017-03-15 19:57:00,CA San Diego,-117.1610838,32.715738
16,3/15/17 17:50,Chesnee,SC,light,10 minutes,2017-03-15 17:50:00,600.0,2017-03-15 18:00:00,SC Chesnee,-81.8609371,35.1484549
17,3/15/17 17:50,Phoenix,AZ,oval,5 minutes,2017-03-15 17:50:00,300.0,2017-03-15 17:55:00,AZ Phoenix,-112.0740373,33.4483771
18,3/15/17 09:51,Huntsville,AL,disk,~6 minutes,2017-03-15 09:51:00,360.0,2017-03-15 09:57:00,AL Huntsville,-86.5861037,34.7303688
19,3/15/17 07:15,Phoenix,AZ,circle,25 minutes,2017-03-15 07:15:00,1500.0,2017-03-15 07:40:00,AZ Phoenix,-112.0740373,33.4483771
21,3/15/17 03:00,Volcano,CA,light,2 hours,2017-03-15 03:00:00,7200.0,2017-03-15 05:00:00,CA Volcano,-120.6307628,38.4429658
22,3/14/17 23:50,Aliso Viejo,CA,light,30 minutes,2017-03-14 23:50:00,1800.0,2017-03-15 00:20:00,CA Aliso Viejo,-117.7256083,33.5676842
24,3/14/17 22:10,Lava Hot Springs,ID,other,8 minutes,2017-03-14 22:10:00,480.0,2017-03-14 22:18:00,ID Lava Hot Springs,-112.0110712,42.6193625
25,3/14/17 20:24,Chandler,AZ,sphere,2 minutes,2017-03-14 20:24:00,120.0,2017-03-14 20:26:00,AZ Chandler,-111.8412502,33.3061605
26,3/14/17 18:30,Denver,CO,circle,1 hour,2017-03-14 18:30:00,3600.0,2017-03-14 19:30:00,CO Denver,-104.990251,39.7392358
27,3/14/17 06:45,Phoenix,AZ,other,5-10 minutes,2017-03-14 06:45:00,600.0,2017-03-14 06:55:00,AZ Phoenix,-112.0740373,33.4483771
28,3/14/17 05:00,Goodyear,AZ,triangle,2 hours,2017-03-14 05:00:00,7200.0,2017-03-14 07:00:00,AZ Goodyear,-112.3576567,33.4353394
29,3/14/17,Tampa,FL,light,30 minutes,2017-03-14 00:00:00,1800.0,2017-03-14 00:30:00,FL Tampa,-82.4571776,27.950575
30,3/13/17 21:26,Mesa,AZ,sphere,6 minutes,2017-03-13 21:26:00,360.0,2017-03-13 21:32:00,AZ Mesa,-111.8314724,33.4151843
31,3/13/17 21:00,Glendale,AZ,light,20 minutes,2017-03-13 21:00:00,1200.0,2017-03-13 21:20:00,AZ Glendale,-112.1859866,33.5386523
32,3/13/17 20:50,Redlands,CA,oval,30 seconds,2017-03-13 20:50:00,30.0,2017-03-13 20:50:30,CA Redlands,-117.1825381,34.0555693
33,3/13/17 14:00,Las Vegas,NV,egg,1 minute,2017-03-13 14:00:00,60.0,2017-03-13 14:01:00,NV Las Vegas,-115.1398296,36.1699412
34,3/12/17 23:00,Colton,OR,other,5 minutes,2017-03-12 23:00:00,300.0,2017-03-12 23:05:00,OR Colton,-122.4374803,45.1721192
36,3/12/17 20:43,Gloucester,VA,light,25 seconds,2017-03-12 20:43:00,25.0,2017-03-12 20:43:25,VA Gloucester,-76.5266174,37.4098631
37,3/12/17 20:40,Mount Airy,NC,sphere,5 seconds,2017-03-12 20:40:00,5.0,2017-03-12 20:40:05,NC Mount Airy,-80.6072858,36.4993007
38,3/12/17 20:01,Sanford,NC,circle,35 minutes,2017-03-12 20:01:00,2100.0,2017-03-12 20:36:00,NC Sanford,-79.1802994,35.4798757
39,3/12/17 20:00,Redlands,CA,sphere,1 hour,2017-03-12 20:00:00,3600.0,2017-03-12 21:00:00,CA Redlands,-117.1825381,34.0555693
40,3/12/17 20:00,Long Beach,CA,flash,5 minutes,2017-03-12 20:00:00,300.0,2017-03-12 20:05:00,CA Long Beach,-118.1937395,33.7700504
41,3/12/17 19:45,Hot Springs National Park,AR,formation,2:00 minutes,2017-03-12 19:45:00,0.0,2017-03-12 19:45:00,AR Hot Springs National Park,-93.0423545,34.5216915
42,3/12/17 19:45,Tacoma,WA,circle,~10 minutes,2017-03-12 19:45:00,600.0,2017-03-12 19:55:00,WA Tacoma,-122.4442906,47.2528768
43,3/12/17 19:30,Paw Paw,MI,light,4 minutes,2017-03-12 19:30:00,240.0,2017-03-12 19:34:00,MI Paw Paw,-85.8911246,42.2178171
44,3/12/17 18:20,Boaz,AL,unknown,10 minutes,2017-03-12 18:20:00,600.0,2017-03-12 18:30:00,AL Boaz,-86.1520969,34.2031662
45,3/12/17 18:00,Chapmanville,WV,light,2-3 seconds,2017-03-12 18:00:00,3.0,2017-03-12 18:00:03,WV Chapmanville,-82.0173502,37.9737114
46,3/12/17 08:10,Elk Grove,CA,sphere,40 minutes,2017-03-12 08:10:00,2400.0,2017-03-12 08:50:00,CA Elk Grove,-121.3716178,38.4087993
47,3/12/17 08:10,Elk Grove,CA,sphere,40 minutes,2017-03-12 08:10:00,2400.0,2017-03-12 08:50:00,CA Elk Grove,-121.3716178,38.4087993
48,3/11/17 23:15,Atlanta,GA,light,15 seconds,2017-03-11 23:15:00,15.0,2017-03-11 23:15:15,GA Atlanta,-84.3879824,33.7489954
49,3/11/17 22:00,Lewis center,OH,fireball,3 minutes,2017-03-11 22:00:00,180.0,2017-03-11 22:03:00,OH Lewis center,-83.0100987,40.1983884
50,3/11/17 21:41,Virginia Beach,VA,fireball,3 minutes,2017-03-11 21:41:00,180.0,2017-03-11 21:44:00,VA Virginia Beach,-75.977985,36.8529263
51,3/11/17 21:31,Ottawa (Canada),ON,oval,4-5 seconds,2017-03-11 21:31:00,5.0,2017-03-11 21:31:05,ON Ottawa (Canada),-75.6971931,45.4215296
52,3/11/17 20:55,Casa Grande,AZ,circle,3 minutes,2017-03-11 20:55:00,180.0,2017-03-11 20:58:00,AZ Casa Grande,-111.7573521,32.8795022
53,3/11/17 20:00,Concord,NC,light,5 minutes,2017-03-11 20:00:00,300.0,2017-03-11 20:05:00,NC Concord,-80.579511,35.4087517
55,3/11/17 18:00,Lavallette,NJ,other,8 hours,2017-03-11 18:00:00,28800.0,2017-03-12 02:00:00,NJ Lavallette,-74.0687475,39.9703958
56,3/11/17 18:00,Lavallette,NJ,other,8 hours,2017-03-11 18:00:00,28800.0,2017-03-12 02:00:00,NJ Lavallette,-74.0687475,39.9703958
57,3/11/17 06:00,Mt. Airy,NC,cigar,1 second,2017-03-11 06:00:00,1.0,2017-03-11 06:00:01,NC Mt. Airy,-80.6072858,36.4993007
58,3/11/17 05:00,Wausau,WI,cigar,15 minutes,2017-03-11 05:00:00,900.0,2017-03-11 05:15:00,WI Wausau,-89.6301221,44.9591352
59,3/10/17 23:00,Frisco,TX,oval,2-3 minutes,2017-03-10 23:00:00,180.0,2017-03-10 23:03:00,TX Frisco,-96.8236116,33.1506744
60,3/10/17 22:00,Yarmouth (Nova Scotia)(Canada),NS,rectangle,2 minutes,2017-03-10 22:00:00,120.0,2017-03-10 22:02:00,NS Yarmouth (Nova Scotia)(Canada),-66.117382,43.8374576
61,3/10/17 20:30,Clarksville,TN,other,10 minutes,2017-03-10 20:30:00,600.0,2017-03-10 20:40:00,TN Clarksville,-87.3594528,36.5297706
62,3/10/17 20:30,Clarksville,TN,cigar,15 minutes,2017-03-10 20:30:00,900.0,2017-03-10 20:45:00,TN Clarksville,-87.3594528,36.5297706
64,3/10/17 19:15,Des Moines,WA,light,5 minutes,2017-03-10 19:15:00,300.0,2017-03-10 19:20:00,WA Des Moines,-122.3242902,47.4017661
65,3/10/17 08:00,Alexandria,IN,circle,30 minutes,2017-03-10 08:00:00,1800.0,2017-03-10 08:30:00,IN Alexandria,-77.0469214,38.8048355
66,3/10/17 05:55,Battle Creek,MI,light,5 minutes,2017-03-10 05:55:00,300.0,2017-03-10 06:00:00,MI Battle Creek,-85.1797142,42.3211522
67,3/10/17 00:30,Newton,KS,triangle,~10 minutes,2017-03-10 00:30:00,600.0,2017-03-10 00:40:00,KS Newton,-97.3450365,38.0466779
68,3/9/17 00:00,Bellevue,WA,unknown,20 minutes,2017-03-09 00:00:00,1200.0,2017-03-09 00:20:00,WA Bellevue,-122.2015159,47.6101497
69,3/9/17 00:00,Dartmouth (Canada),NS,light,1 hour,2017-03-09 00:00:00,3600.0,2017-03-09 01:00:00,NS Dartmouth (Canada),-63.5677427,44.6652059
71,3/9/17 21:00,Valley Center,CA,circle,10 minutes,2017-03-09 21:00:00,600.0,2017-03-09 21:10:00,CA Valley Center,-117.0341967,33.2183701
72,3/9/17 20:30,St. Louis,MO,light,20 seconds,2017-03-09 20:30:00,20.0,2017-03-09 20:30:20,MO St. Louis,-90.1994042,38.6270025
73,3/9/17 20:00,Port Saint Lucie,FL,triangle,7 minutes,2017-03-09 20:00:00,420.0,2017-03-09 20:07:00,FL Port Saint Lucie,-80.3582261,27.2730492
74,3/9/17 19:45,LaFayette,IL,light,5 minutes,2017-03-09 19:45:00,300.0,2017-03-09 19:50:00,IL LaFayette,-88.3044908,39.4948223
75,3/9/17 19:37,Las Vegas,NV,light,3 minutes,2017-03-09 19:37:00,180.0,2017-03-09 19:40:00,NV Las Vegas,-115.1398296,36.1699412
77,3/9/17 18:35,Prince Albert (Canada),SK,other,2 minutes,2017-03-09 18:35:00,120.0,2017-03-09 18:37:00,SK Prince Albert (Canada),-105.7530705,53.2033494
78,3/9/17 15:15,Leonardtown,MD,circle,15-25 seconds,2017-03-09 15:15:00,25.0,2017-03-09 15:15:25,MD Leonardtown,-76.6357942,38.291238
79,3/9/17 05:55,Saint Joseph,MO,sphere,20 second,2017-03-09 05:55:00,20.0,2017-03-09 05:55:20,MO Saint Joseph,-94.846681,39.7674578
80,3/9/17 03:12,Vestavia,AL,oval,1 hour +,2017-03-09 03:12:00,3600.0,2017-03-09 04:12:00,AL Vestavia,-86.7877668,33.4487183
81,3/9/17 01:00,Melbourne,FL,light,10 minutes,2017-03-09 01:00:00,600.0,2017-03-09 01:10:00,FL Melbourne,-80.6081089,28.0836269
82,3/8/17 23:30,Lockwood,MO,triangle,10 minutes,2017-03-08 23:30:00,600.0,2017-03-08 23:40:00,MO Lockwood,-93.9532705,37.3856044
83,3/8/17 20:00,Piney Flats,TN,circle,30 minutes,2017-03-08 20:00:00,1800.0,2017-03-08 20:30:00,TN Piney Flats,-82.3048542,36.4192723
84,3/8/17 18:30,Riverdale,NJ,circle,15 minutes,2017-03-08 18:30:00,900.0,2017-03-08 18:45:00,NJ Riverdale,-74.3034823,40.9939865
85,3/8/17 16:54,Ypsilanti,MI,circle,1 hour,2017-03-08 16:54:00,3600.0,2017-03-08 17:54:00,MI Ypsilanti,-83.6129939,42.2411499
86,3/8/17 02:00,Phoenix,AZ,unknown,10 minutes,2017-03-08 02:00:00,600.0,2017-03-08 02:10:00,AZ Phoenix,-112.0740373,33.4483771
87,3/8/17 00:30,Gray Court,SC,light,15 minutes,2017-03-08 00:30:00,900.0,2017-03-08 00:45:00,SC Gray Court,-82.113438,34.6081774
88,3/8/17 00:30,Gray Court,SC,light,15 minutes,2017-03-08 00:30:00,900.0,2017-03-08 00:45:00,SC Gray Court,-82.113438,34.6081774
89,3/7/17 23:00,Princeton,IN,light,3 hours+,2017-03-07 23:00:00,10800.0,2017-03-08 02:00:00,IN Princeton,-87.5675222,38.3553236
90,3/7/17 21:20,Philadelphia,PA,chevron,>1 minute,2017-03-07 21:20:00,60.0,2017-03-07 21:21:00,PA Philadelphia,-75.1652215,39.9525839
91,3/7/17 20:30,San Angelo,TX,triangle,30-40 seconds,2017-03-07 20:30:00,40.0,2017-03-07 20:30:40,TX San Angelo,-100.4370375,31.4637723
92,3/7/17 20:10,Summerville,SC,sphere,15-20 seconds,2017-03-07 20:10:00,20.0,2017-03-07 20:10:20,SC Summerville,-80.1756481,33.0185039
93,3/7/17 20:00,Lexington,KY,oval,2 minutes,2017-03-07 20:00:00,120.0,2017-03-07 20:02:00,KY Lexington,-84.5037164,38.0405837
94,3/7/17 19:00,Fort Worth,TX,light,40 minutes,2017-03-07 19:00:00,2400.0,2017-03-07 19:40:00,TX Fort Worth,-97.3307658,32.7554883
96,3/7/17 12:00,Jamestown,CA,fireball,4 hours,2017-03-07 12:00:00,14400.0,2017-03-07 16:00:00,CA Jamestown,-120.4226952,37.9532584
97,3/6/17 22:00,Elkton,MD,rectangle,2 minutes,2017-03-06 22:00:00,120.0,2017-03-06 22:02:00,MD Elkton,-75.8332718,39.6067789
99,3/6/17 21:48,Meridian,MS,diamond,10 seconds,2017-03-06 21:48:00,10.0,2017-03-06 21:48:10,MS Meridian,-88.703656,32.3643098
100,3/6/17 19:58,Modesto,CA,circle,6 minutes,2017-03-06 19:58:00,360.0,2017-03-06 20:04:00,CA Modesto,-120.9968782,37.6390972
102,3/6/17 19:11,Ft. Lauderdale,FL,circle,10 seconds,2017-03-06 19:11:00,10.0,2017-03-06 19:11:10,FL Ft. Lauderdale,-80.1373174,26.1224386
103,3/6/17 18:45,Walker,LA,triangle,2-3 minutes,2017-03-06 18:45:00,180.0,2017-03-06 18:48:00,LA Walker,-90.8614878,30.4879678
104,3/6/17 12:15,Lisbon,ME,fireball,20 second,2017-03-06 12:15:00,20.0,2017-03-06 12:15:20,ME Lisbon,-70.1043704,44.0316013
105,3/6/17 04:15,Milford,CT,disk,1 hour,2017-03-06 04:15:00,3600.0,2017-03-06 05:15:00,CT Milford,-73.064036,41.2306979
107,3/5/17 22:28,Brookline,NH,light,10 minutes,2017-03-05 22:28:00,600.0,2017-03-05 22:38:00,NH Brookline,-71.6581267,42.7348102
108,3/5/17 20:29,Anchorage,AK,circle,30 minutes,2017-03-05 20:29:00,1800.0,2017-03-05 20:59:00,AK Anchorage,-149.9002778,61.2180556
109,3/5/17 20:00,Holbrook,NY,teardrop,5 minutes,2017-03-05 20:00:00,300.0,2017-03-05 20:05:00,NY Holbrook,-73.0784429,40.8123205
110,3/5/17 14:00,Anola (Canada),MB,sphere,1-2 minutes,2017-03-05 14:00:00,120.0,2017-03-05 14:02:00,MB Anola (Canada),-96.6233317,49.8811655
111,3/5/17 13:30,Honeybrook,PA,circle,1 minute,2017-03-05 13:30:00,60.0,2017-03-05 13:31:00,PA Honeybrook,-75.9113306,40.0942664
113,3/5/17 03:04,Upper Freehold Township,NJ,other,10 minutes,2017-03-05 03:04:00,600.0,2017-03-05 03:14:00,NJ Upper Freehold Township,-74.5228916,40.174405
114,3/4/17 23:00,Pittsburgh,PA,light,2-3 minutes,2017-03-04 23:00:00,180.0,2017-03-04 23:03:00,PA Pittsburgh,-79.9958864,40.4406248
116,3/4/17 21:48,Sioux Falls,SD,sphere,5 seconds,2017-03-04 21:48:00,5.0,2017-03-04 21:48:05,SD Sioux Falls,-96.7311034,43.5445959
117,3/4/17 21:00,Absarokee,MT,other,1 hour,2017-03-04 21:00:00,3600.0,2017-03-04 22:00:00,MT Absarokee,-109.4429444,45.5204982
118,3/4/17 20:30,Amelia Island,FL,triangle,8 seconds,2017-03-04 20:30:00,8.0,2017-03-04 20:30:08,FL Amelia Island,-81.460856,30.6265697
120,3/4/17 20:10,Donaldsonville,GA,light,2:00 minutes,2017-03-04 20:10:00,0.0,2017-03-04 20:10:00,GA Donaldsonville,-84.8790911,31.0404625
121,3/4/17 19:40,Lynchburg,VA,diamond,"45 minutes, I went in",2017-03-04 19:40:00,2700.0,2017-03-04 20:25:00,VA Lynchburg,-79.1422464,37.4137536
123,3/4/17 19:00,Kaukauna,WI,light,45 minutes,2017-03-04 19:00:00,2700.0,2017-03-04 19:45:00,WI Kaukauna,-88.2720503,44.2780432
124,3/4/17 18:42,Lynchburg,VA,fireball,3 minutes,2017-03-04 18:42:00,180.0,2017-03-04 18:45:00,VA Lynchburg,-79.1422464,37.4137536
126,3/4/17 15:30,Kitchener (Canada),ON,light,30-60 seconds,2017-03-04 15:30:00,60.0,2017-03-04 15:31:00,ON Kitchener (Canada),-80.4831917,43.450301
127,3/4/17 15:00,Cleveland,OH,cylinder,10 minutes,2017-03-04 15:00:00,600.0,2017-03-04 15:10:00,OH Cleveland,-81.6943605,41.49932
129,3/4/17 04:00,Soldotna,AK,unknown,1-2 minutes,2017-03-04 04:00:00,120.0,2017-03-04 04:02:00,AK Soldotna,-151.0583332,60.4877778
130,3/4/17 01:00,Englewood,CO,disk,3-5 seconds,2017-03-04 01:00:00,5.0,2017-03-04 01:00:05,CO Englewood,-104.9877597,39.6477653
131,3/3/17 21:38,Fairbanks,AK,sphere,1-2 minutes,2017-03-03 21:38:00,120.0,2017-03-03 21:40:00,AK Fairbanks,-147.7163889,64.8377778
132,3/3/17 21:00,Temecula,CA,triangle,20 seconds,2017-03-03 21:00:00,20.0,2017-03-03 21:00:20,CA Temecula,-117.1483648,33.4936391
135,3/3/17 19:36,Yuma,AZ,oval,1.5 minutes,2017-03-03 19:36:00,300.0,2017-03-03 19:41:00,AZ Yuma,-114.6276916,32.6926512
136,3/3/17 19:30,Longmont,CO,light,>1 hour,2017-03-03 19:30:00,3600.0,2017-03-03 20:30:00,CO Longmont,-105.1019275,40.1672068
137,3/3/17 19:25,Wilmington,DE,fireball,30 seconds,2017-03-03 19:25:00,30.0,2017-03-03 19:25:30,DE Wilmington,-75.5397878,39.7390721
138,3/3/17 19:05,Ridgecrest,CA,unknown,45 seconds,2017-03-03 19:05:00,45.0,2017-03-03 19:05:45,CA Ridgecrest,-117.6708966,35.6224561
139,3/3/17 19:05,Ridgecrest,CA,unknown,45 seconds,2017-03-03 19:05:00,45.0,2017-03-03 19:05:45,CA Ridgecrest,-117.6708966,35.6224561
140,3/3/17 17:30,Wetumpka,AL,sphere,5 seconds,2017-03-03 17:30:00,5.0,2017-03-03 17:30:05,AL Wetumpka,-86.2119127,32.5437448
142,3/3/17 06:10,Index,WA,formation,1 minute,2017-03-03 06:10:00,60.0,2017-03-03 06:11:00,WA Index,-121.5551086,47.8206605
143,3/3/17 00:00,Fort Myers,FL,light,1-2 hours,2017-03-03 00:00:00,7200.0,2017-03-03 02:00:00,FL Fort Myers,-81.8723084,26.640628
144,3/2/17 22:30,Lake Conroe,TX,light,3 hours,2017-03-02 22:30:00,10800.0,2017-03-03 01:30:00,TX Lake Conroe,-95.5984925,30.4368954
145,3/2/17 22:00,Waco,TX,triangle,2-3 minutes,2017-03-02 22:00:00,180.0,2017-03-02 22:03:00,TX Waco,-97.1466695,31.549333
147,3/2/17 20:00,Springfield,MO,triangle,1 minute,2017-03-02 20:00:00,60.0,2017-03-02 20:01:00,MO Springfield,-93.2922989,37.2089572
149,3/2/17 05:00,Fayetteville,TN,triangle,20 seconds,2017-03-02 05:00:00,20.0,2017-03-02 05:00:20,TN Fayetteville,-86.5705508,35.1520266
150,3/1/17 20:21,Cloquet,MN,triangle,30 seconds,2017-03-01 20:21:00,30.0,2017-03-01 20:21:30,MN Cloquet,-92.4611825,46.7217735
152,3/1/17 20:00,Dodge City,KS,circle,10 hours,2017-03-01 20:00:00,36000.0,2017-03-02 06:00:00,KS Dodge City,-100.0170787,37.7527982
155,3/1/17 18:30,Ingram,TX,flash,5 seconds,2017-03-01 18:30:00,5.0,2017-03-01 18:30:05,TX Ingram,-99.2403213,30.0774307
156,3/1/17 13:35,Islip Terrace,NY,rectangle,4 hours,2017-03-01 13:35:00,14400.0,2017-03-01 17:35:00,NY Islip Terrace,-73.1881781,40.7494306
157,2/28/17 19:45,Phoenix,AZ,fireball,3 minutes,2017-02-28 19:45:00,180.0,2017-02-28 19:48:00,AZ Phoenix,-112.0740373,33.4483771
158,2/28/17 18:57,Atascocta,TX,unknown,4 second,2017-02-28 18:57:00,4.0,2017-02-28 18:57:04,TX Atascocta,-95.1765978,29.9988306
160,2/28/17 12:00,Jamestown,CA,fireball,4 hours,2017-02-28 12:00:00,14400.0,2017-02-28 16:00:00,CA Jamestown,-120.4226952,37.9532584
161,2/28/17 04:50,Vacaville,CA,sphere,2-3 seconds,2017-02-28 04:50:00,3.0,2017-02-28 04:50:03,CA Vacaville,-121.9877444,38.3565773
163,2/27/17 19:30,Fountain,CO,cross,1 hour,2017-02-27 19:30:00,3600.0,2017-02-27 20:30:00,CO Fountain,-104.7008056,38.682219
164,2/27/17 19:30,Billings,MT,light,5 minutes,2017-02-27 19:30:00,300.0,2017-02-27 19:35:00,MT Billings,-108.5006904,45.7832856
165,2/27/17 19:00,Plains,KS,light,1 hour +-,2017-02-27 19:00:00,3600.0,2017-02-27 20:00:00,KS Plains,-100.5926524,37.2602994
166,2/27/17 18:40,Crescent Valley,NV,unknown,5 minutes,2017-02-27 18:40:00,300.0,2017-02-27 18:45:00,NV Crescent Valley,-116.5764745,40.4160278
167,2/27/17 18:11,Folsom,CA,sphere,30-60 seconds,2017-02-27 18:11:00,60.0,2017-02-27 18:12:00,CA Folsom,-121.1760583,38.6779591
168,2/27/17 01:30,Tuscaloosa,AL,unknown,~30 minutes,2017-02-27 01:30:00,1800.0,2017-02-27 02:00:00,AL Tuscaloosa,-87.5691735,33.2098407
170,2/26/17 23:00,Tuscaloosa,AL,light,1 minutes,2017-02-26 23:00:00,60.0,2017-02-26 23:01:00,AL Tuscaloosa,-87.5691735,33.2098407
171,2/26/17 22:51,Wasilla,AK,oval,2-3 minutes,2017-02-26 22:51:00,180.0,2017-02-26 22:54:00,AK Wasilla,-149.4394444,61.5813889
172,2/26/17 22:00,Decatur,GA,circle,5 minutes,2017-02-26 22:00:00,300.0,2017-02-26 22:05:00,GA Decatur,-84.2963123,33.7748275
173,2/26/17 21:15,Manistee,MI,unknown,20 minutes,2017-02-26 21:15:00,1200.0,2017-02-26 21:35:00,MI Manistee,-86.324253,44.2444473
175,2/26/17 21:00,Decatur,GA,circle,3 minutes,2017-02-26 21:00:00,180.0,2017-02-26 21:03:00,GA Decatur,-84.2963123,33.7748275
177,2/26/17 20:30,Easton,PA,fireball,10 seconds,2017-02-26 20:30:00,10.0,2017-02-26 20:30:10,PA Easton,-75.2207323,40.688432
179,2/26/17 20:25,Lutz,FL,circle,20 minutes,2017-02-26 20:25:00,1200.0,2017-02-26 20:45:00,FL Lutz,-82.4614831,28.1511243
180,2/26/17 20:23,Prescott,AZ,light,30 seconds,2017-02-26 20:23:00,30.0,2017-02-26 20:23:30,AZ Prescott,-112.4685025,34.5400242
181,2/26/17 20:06,Cody,WY,fireball,4 seconds,2017-02-26 20:06:00,4.0,2017-02-26 20:06:04,WY Cody,-109.0565308,44.5263422
182,2/26/17 20:00,Sacramento,CA,other,45 minutes,2017-02-26 20:00:00,2700.0,2017-02-26 20:45:00,CA Sacramento,-121.4943996,38.5815719
183,2/26/17 19:00,Newark,DE,oval,1-2 mins,2017-02-26 19:00:00,120.0,2017-02-26 19:02:00,DE Newark,-75.7496572,39.6837226
184,2/26/17 18:00,Dubuque,IA,triangle,Nightly-2 hours,2017-02-26 18:00:00,7200.0,2017-02-26 20:00:00,IA Dubuque,-90.6645718,42.5005583
185,2/26/17 18:00,Carpentersville,IL,flash,15 minutes,2017-02-26 18:00:00,900.0,2017-02-26 18:15:00,IL Carpentersville,-88.2578582,42.1211364
186,2/26/17 15:30,Superior,WI,egg,3-5 minutes,2017-02-26 15:30:00,300.0,2017-02-26 15:35:00,WI Superior,-92.1040796,46.7207737
189,2/26/17 05:50,Freeport,NY,oval,45 seconds,2017-02-26 05:50:00,45.0,2017-02-26 05:50:45,NY Freeport,-73.5831835,40.6576022
190,2/26/17 05:20,Bend,OR,light,30 minutes,2017-02-26 05:20:00,1800.0,2017-02-26 05:50:00,OR Bend,-121.3153096,44.0581728
191,2/25/17 23:27,Chicago,IL,light,5 seconds,2017-02-25 23:27:00,5.0,2017-02-25 23:27:05,IL Chicago,-87.6297982,41.8781136
192,2/25/17 22:10,Sandy,UT,circle,10 minutes,2017-02-25 22:10:00,600.0,2017-02-25 22:20:00,UT Sandy,-111.8389726,40.5649781
193,2/25/17 21:30,Albany (near),OR,rectangle,5 minutes,2017-02-25 21:30:00,300.0,2017-02-25 21:35:00,OR Albany (near),-123.1059282,44.6365107
194,2/25/17 21:00,Canton,GA,cigar,2+hrs,2017-02-25 21:00:00,7200.0,2017-02-25 23:00:00,GA Canton,-84.4907621,34.2367621
195,2/25/17 21:00,Glendive,MT,light,15 minutes,2017-02-25 21:00:00,900.0,2017-02-25 21:15:00,MT Glendive,-104.7107931,47.106401
196,2/25/17 21:00,Watson Lake (Canada),YT,light,1 hour +,2017-02-25 21:00:00,3600.0,2017-02-25 22:00:00,YT Watson Lake (Canada),-128.710913,60.062806
197,2/25/17 21:00,las vegas,NV,circle,5 minutes,2017-02-25 21:00:00,300.0,2017-02-25 21:05:00,NV las vegas,-115.1398296,36.1699412
198,2/25/17 19:35,Orlando,FL,formation,1-2 minutes,2017-02-25 19:35:00,120.0,2017-02-25 19:37:00,FL Orlando,-81.3792365,28.5383355
199,2/25/17 19:15,Highland,KS,light,2 hours,2017-02-25 19:15:00,7200.0,2017-02-25 21:15:00,KS Highland,-95.2696985,39.8597208
201,2/25/17 18:45,Longmont,CO,oval,5 minutes,2017-02-25 18:45:00,300.0,2017-02-25 18:50:00,CO Longmont,-105.1019275,40.1672068
202,2/25/17 18:15,Long Beach,CA,oval,20 seconds,2017-02-25 18:15:00,20.0,2017-02-25 18:15:20,CA Long Beach,-118.1937395,33.7700504
203,2/25/17 14:16,Mesa,AZ,sphere,5 minutes,2017-02-25 14:16:00,300.0,2017-02-25 14:21:00,AZ Mesa,-111.8314724,33.4151843
205,2/25/17 13:15,Broomfield,CO,teardrop,2 minutes,2017-02-25 13:15:00,120.0,2017-02-25 13:17:00,CO Broomfield,-105.0866504,39.9205411
206,2/25/17 10:00,Elk Grove,CA,circle,8 minutes,2017-02-25 10:00:00,480.0,2017-02-25 10:08:00,CA Elk Grove,-121.3716178,38.4087993
207,2/25/17 04:45,Fall Creek,OR,sphere,15 minutes,2017-02-25 04:45:00,900.0,2017-02-25 05:00:00,OR Fall Creek,-122.8203521,43.9595707
208,2/24/17 23:42,Beacon,NY,light,1 hour,2017-02-24 23:42:00,3600.0,2017-02-25 00:42:00,NY Beacon,-73.9695832,41.5048158
209,2/24/17 23:00,Omaha,NE,rectangle,2 minutes?,2017-02-24 23:00:00,120.0,2017-02-24 23:02:00,NE Omaha,-95.9979883,41.2523634
210,2/24/17 22:40,winter harbor,ME,light,1 hour,2017-02-24 22:40:00,3600.0,2017-02-24 23:40:00,ME winter harbor,-68.0830278,44.3947873
212,2/24/17 21:00,Bridgeport,CT,circle,20 minutes,2017-02-24 21:00:00,1200.0,2017-02-24 21:20:00,CT Bridgeport,-73.1951767,41.1865478
213,2/24/17 20:45,Port Saint Lucie,FL,circle,5 minutes,2017-02-24 20:45:00,300.0,2017-02-24 20:50:00,FL Port Saint Lucie,-80.3582261,27.2730492
214,2/24/17 20:30,Ravenna,OH,oval,30 minutes,2017-02-24 20:30:00,1800.0,2017-02-24 21:00:00,OH Ravenna,-81.2420473,41.1575566
215,2/24/17 20:30,Santa Fe,NM,fireball,20 minutes,2017-02-24 20:30:00,1200.0,2017-02-24 20:50:00,NM Santa Fe,-105.937799,35.6869752
216,2/24/17 20:30,Payson,AZ,other,10 minutes,2017-02-24 20:30:00,600.0,2017-02-24 20:40:00,AZ Payson,-111.3251355,34.2308684
217,2/24/17 20:00,Uniontown,PA,circle,24 hours,2017-02-24 20:00:00,86400.0,2017-02-25 20:00:00,PA Uniontown,-79.7164326,39.900076
219,2/24/17 20:00,Bennington,VT,light,5 minutes,2017-02-24 20:00:00,300.0,2017-02-24 20:05:00,VT Bennington,-73.1967741,42.8781345
220,2/24/17 19:40,Buckeye/Litchfield Park,AZ,circle,10 minutes,2017-02-24 19:40:00,600.0,2017-02-24 19:50:00,AZ Buckeye/Litchfield Park,-112.3612522,33.4651503
222,2/24/17 03:00,Dallas,TX,light,30 minutes,2017-02-24 03:00:00,1800.0,2017-02-24 03:30:00,TX Dallas,-96.7969879,32.7766642
223,2/24/17 03:00,Dallas,TX,light,30 minutes,2017-02-24 03:00:00,1800.0,2017-02-24 03:30:00,TX Dallas,-96.7969879,32.7766642
224,2/23/17 00:00,Fort Lauderdale,FL,fireball,3 minutes,2017-02-23 00:00:00,180.0,2017-02-23 00:03:00,FL Fort Lauderdale,-80.1373174,26.1224386
225,2/23/17 22:00,Chattanooga,TN,sphere,30 minutes,2017-02-23 22:00:00,1800.0,2017-02-23 22:30:00,TN Chattanooga,-85.3096801,35.0456297
226,2/23/17 21:00,Hiram,GA,light,20-30 minutes,2017-02-23 21:00:00,1800.0,2017-02-23 21:30:00,GA Hiram,-84.7621592,33.8756601
227,2/23/17 21:00,Hamilton,MS,sphere,2 hours,2017-02-23 21:00:00,7200.0,2017-02-23 23:00:00,MS Hamilton,-88.4116881,33.740225
228,2/23/17 20:30,West Valley City,UT,sphere,2 minutes,2017-02-23 20:30:00,120.0,2017-02-23 20:32:00,UT West Valley City,-112.0010501,40.6916132
229,2/23/17 19:50,Rosendale,NY,sphere,4 seconds,2017-02-23 19:50:00,4.0,2017-02-23 19:50:04,NY Rosendale,-74.0810669,41.8443125
230,2/23/17 19:40,Greenfield Twp,PA,circle,15 minutes,2017-02-23 19:40:00,900.0,2017-02-23 19:55:00,PA Greenfield Twp,-75.5858886,41.6100969
231,2/23/17 19:30,Reading,PA,unknown,4 minutes,2017-02-23 19:30:00,240.0,2017-02-23 19:34:00,PA Reading,-75.9268747,40.3356483
232,2/23/17 18:43,Philadelphia,PA,changing,2-3 minutes,2017-02-23 18:43:00,180.0,2017-02-23 18:46:00,PA Philadelphia,-75.1652215,39.9525839
233,2/23/17 18:00,Eaton,CO,circle,1-2 minutes,2017-02-23 18:00:00,120.0,2017-02-23 18:02:00,CO Eaton,-104.702515,40.5194046
234,2/23/17 17:30,Clarksville,TN,disk,2 seconds,2017-02-23 17:30:00,2.0,2017-02-23 17:30:02,TN Clarksville,-87.3594528,36.5297706
235,2/23/17 15:10,Albuquerque,NM,flash,1 minute,2017-02-23 15:10:00,60.0,2017-02-23 15:11:00,NM Albuquerque,-106.6055534,35.0853336
238,2/23/17 06:00,Acworth,GA,cylinder,2 minutes,2017-02-23 06:00:00,120.0,2017-02-23 06:02:00,GA Acworth,-84.6768796,34.0659329
239,2/23/17 05:45,Brook Park,OH,flash,3 seconds,2017-02-23 05:45:00,3.0,2017-02-23 05:45:03,OH Brook Park,-81.8045788,41.3983838
240,2/23/17 00:00,Syracuse,NY,other,30 seconds,2017-02-23 00:00:00,30.0,2017-02-23 00:00:30,NY Syracuse,-76.1474244,43.0481221
241,2/22/17 21:50,Auburn,AL,unknown,3 minutes,2017-02-22 21:50:00,180.0,2017-02-22 21:53:00,AL Auburn,-85.4807825,32.6098566
243,2/22/17 21:00,Tamaqua,PA,cylinder,10 minutes,2017-02-22 21:00:00,600.0,2017-02-22 21:10:00,PA Tamaqua,-75.9693707,40.7973112
244,2/22/17 21:00,Whitefish,MT,light,15 minutes,2017-02-22 21:00:00,900.0,2017-02-22 21:15:00,MT Whitefish,-114.3352652,48.4106373
245,2/22/17 21:00,Fountain Valley,CA,unknown,3 minutes,2017-02-22 21:00:00,180.0,2017-02-22 21:03:00,CA Fountain Valley,-117.9536697,33.7091847
246,2/22/17 20:50,Bowen Island (Canada),BC,egg,15 minutes,2017-02-22 20:50:00,900.0,2017-02-22 21:05:00,BC Bowen Island (Canada),-123.3701541,49.3767653
247,2/22/17 20:27,Beaufort,SC,cross,1-2 Minutes,2017-02-22 20:27:00,120.0,2017-02-22 20:29:00,SC Beaufort,-80.669148,32.4364815
248,2/22/17 19:45,Casco,ME,light,25 minutes,2017-02-22 19:45:00,1500.0,2017-02-22 20:10:00,ME Casco,-70.5211945,43.969246
249,2/22/17 19:30,Swanville,ME,light,45 minutes,2017-02-22 19:30:00,2700.0,2017-02-22 20:15:00,ME Swanville,-68.9978129,44.5211855
250,2/22/17 19:30,Fremont,NJ,light,2-5 minutes,2017-02-22 19:30:00,300.0,2017-02-22 19:35:00,NJ Fremont,-75.0794753,39.9432836
251,2/22/17 19:19,Dothan,AL,circle,7 min,2017-02-22 19:19:00,420.0,2017-02-22 19:26:00,AL Dothan,-85.3904888,31.2232313
252,2/22/17 19:00,Waukesha,WI,oval,3 hours,2017-02-22 19:00:00,10800.0,2017-02-22 22:00:00,WI Waukesha,-88.2314813,43.0116784
253,2/22/17 19:00,Windsor,VT,circle,1 hour,2017-02-22 19:00:00,3600.0,2017-02-22 20:00:00,VT Windsor,-72.3865679,43.4799996
254,2/22/17 18:30,Fullerton,CA,diamond,30 minutes,2017-02-22 18:30:00,1800.0,2017-02-22 19:00:00,CA Fullerton,-117.8869261,33.8829226
255,2/21/17 22:45,Marietta,OH,fireball,&lt;2 Minutes,2017-02-21 22:45:00,120.0,2017-02-21 22:47:00,OH Marietta,-81.4548436,39.415352
256,2/21/17 21:00,Nampa,ID,disk,40 minutes,2017-02-21 21:00:00,2400.0,2017-02-21 21:40:00,ID Nampa,-116.5634624,43.5407172
257,2/21/17 20:00,Phoenix,AZ,light,10minutes,2017-02-21 20:00:00,600.0,2017-02-21 20:10:00,AZ Phoenix,-112.0740373,33.4483771
259,2/21/17 19:00,Simpsonville,SC,oval,1-2 minutes,2017-02-21 19:00:00,120.0,2017-02-21 19:02:00,SC Simpsonville,-82.2542834,34.7370639
261,2/21/17 11:40,Sun City West,AZ,other,3 minutes,2017-02-21 11:40:00,180.0,2017-02-21 11:43:00,AZ Sun City West,-112.3412726,33.6619819
262,2/21/17 11:15,Peoria,AZ,formation,10 minutes,2017-02-21 11:15:00,600.0,2017-02-21 11:25:00,AZ Peoria,-112.2373779,33.5805955
263,2/21/17 07:00,Basehor,KS,light,2.3 hours,2017-02-21 07:00:00,10800.0,2017-02-21 10:00:00,KS Basehor,-94.9385762,39.1416692
265,2/21/17 01:00,Newton,IA,triangle,2 mins,2017-02-21 01:00:00,120.0,2017-02-21 01:02:00,IA Newton,-93.0573533,41.7033177
267,2/20/17 21:30,Roswell,GA,oval,10 minutes,2017-02-20 21:30:00,600.0,2017-02-20 21:40:00,GA Roswell,-84.3615555,34.0232431
269,2/20/17 21:00,Tucson,AZ,light,25 minutes,2017-02-20 21:00:00,1500.0,2017-02-20 21:25:00,AZ Tucson,-110.926479,32.2217429
270,2/20/17 20:50,Porter township,PA,light,20 minutes,2017-02-20 20:50:00,1200.0,2017-02-20 21:10:00,PA Porter township,-75.0844757,41.2410664
271,2/20/17 20:11,Chicago,IL,light,12 Minutes 41 Seconds,2017-02-20 20:11:00,41.0,2017-02-20 20:11:41,IL Chicago,-87.6297982,41.8781136
273,2/20/17 20:00,Butte,MT,triangle,4 minutes,2017-02-20 20:00:00,240.0,2017-02-20 20:04:00,MT Butte,-112.5347776,46.0038232
275,2/20/17 18:40,East Haven,CT,triangle,~5 minutes,2017-02-20 18:40:00,300.0,2017-02-20 18:45:00,CT East Haven,-72.8684565,41.2841687
278,2/19/17 23:05,Cuyahoga Falls,OH,light,6 seconds,2017-02-19 23:05:00,6.0,2017-02-19 23:05:06,OH Cuyahoga Falls,-81.4845585,41.1339449
279,2/19/17 23:00,Lindenwold,NJ,changing,3 hours,2017-02-19 23:00:00,10800.0,2017-02-20 02:00:00,NJ Lindenwold,-74.9851678,39.8201681
280,2/19/17 22:50,Toledo,OH,other,4 seconds,2017-02-19 22:50:00,4.0,2017-02-19 22:50:04,OH Toledo,-83.555212,41.6639383
281,2/19/17 22:30,Atchison,KS,unknown,10 seconds,2017-02-19 22:30:00,10.0,2017-02-19 22:30:10,KS Atchison,-95.1216356,39.5630521
283,2/19/17 22:00,South Dennis,MA,sphere,10-15 minutes,2017-02-19 22:00:00,900.0,2017-02-19 22:15:00,MA South Dennis,-70.1515342,41.7020781
284,2/19/17 21:05,Midland (Canada),ON,light,1 hour,2017-02-19 21:05:00,3600.0,2017-02-19 22:05:00,ON Midland (Canada),-79.8921923,44.749516
285,2/19/17 20:58,Hays,MT,oval,3 hours,2017-02-19 20:58:00,10800.0,2017-02-19 23:58:00,MT Hays,-130.315561,54.28388
287,2/19/17 20:00,Queensbury,NY,circle,1/2 hour,2017-02-19 20:00:00,7200.0,2017-02-19 22:00:00,NY Queensbury,-73.6771662,43.353627
288,2/19/17 19:50,Tacoma,WA,triangle,10  minutes,2017-02-19 19:50:00,600.0,2017-02-19 20:00:00,WA Tacoma,-122.4442906,47.2528768
289,2/19/17 19:30,Bushkill Township,PA,light,2 hours,2017-02-19 19:30:00,7200.0,2017-02-19 21:30:00,PA Bushkill Township,-75.329557,40.7893796
290,2/19/17 19:30,Siler City,NC,sphere,20 minutes,2017-02-19 19:30:00,1200.0,2017-02-19 19:50:00,NC Siler City,-79.4622431,35.7234734
292,2/19/17 17:45,Mananlapan,NJ,light,5hours 45 minutes,2017-02-19 17:45:00,2700.0,2017-02-19 18:30:00,NJ Mananlapan,-74.348582,40.2859203
293,2/19/17 14:00,Shrewsbury,MA,light,~5 minutes,2017-02-19 14:00:00,300.0,2017-02-19 14:05:00,MA Shrewsbury,-71.7128471,42.2959267
294,2/19/17 12:15,Penfield,NY,circle,~10 minutes,2017-02-19 12:15:00,600.0,2017-02-19 12:25:00,NY Penfield,-77.475551,43.1303407
295,2/19/17 11:00,St. Petersburg,FL,sphere,<1 second,2017-02-19 11:00:00,1.0,2017-02-19 11:00:01,FL St. Petersburg,-82.6267345,27.7518284
297,2/19/17 07:30,New York City (Brooklyn),NY,light,30 minutes,2017-02-19 07:30:00,1800.0,2017-02-19 08:00:00,NY New York City (Brooklyn),-73.9441579,40.6781784
298,2/19/17 05:15,Elk Mountain,WY,unknown,2 seconds,2017-02-19 05:15:00,2.0,2017-02-19 05:15:02,WY Elk Mountain,-106.4140868,41.6893961
299,2/19/17 04:12,Londonderry,NH,triangle,30 minutes,2017-02-19 04:12:00,1800.0,2017-02-19 04:42:00,NH Londonderry,-71.3739272,42.8651298
300,2/19/17 04:00,St. Paul,MN,circle,3 seconds,2017-02-19 04:00:00,3.0,2017-02-19 04:00:03,MN St. Paul,-93.0899578,44.9537029
302,2/18/17 22:55,Germantown,MD,other,15 seconds,2017-02-18 22:55:00,15.0,2017-02-18 22:55:15,MD Germantown,-77.2716502,39.1731621
303,2/18/17 22:30,Sawyer,MI,formation,5-10 minutes,2017-02-18 22:30:00,600.0,2017-02-18 22:40:00,MI Sawyer,-86.5898397,41.8855031
304,2/18/17 22:00,Apple valley,MN,circle,~6 minutes,2017-02-18 22:00:00,360.0,2017-02-18 22:06:00,MN Apple valley,-93.21772,44.7319094
305,2/18/17 21:47,West bend,WI,diamond,6 seconds,2017-02-18 21:47:00,6.0,2017-02-18 21:47:06,WI West bend,-88.1834277,43.4252776
306,2/18/17 21:00,Sioux Falls,SD,sphere,>15 minutes,2017-02-18 21:00:00,900.0,2017-02-18 21:15:00,SD Sioux Falls,-96.7311034,43.5445959
307,2/18/17 20:45,Buford,WY,circle,15 minutes,2017-02-18 20:45:00,900.0,2017-02-18 21:00:00,WY Buford,-105.3022921,41.1236875
308,2/18/17 20:45,Buford,WY,circle,15 minutes,2017-02-18 20:45:00,900.0,2017-02-18 21:00:00,WY Buford,-105.3022921,41.1236875
309,2/18/17 20:15,Skokie,IL,circle,2 seconds,2017-02-18 20:15:00,2.0,2017-02-18 20:15:02,IL Skokie,-87.7416246,42.0324025
310,2/18/17 19:10,Colorado Springs,CO,other,2 minutes,2017-02-18 19:10:00,120.0,2017-02-18 19:12:00,CO Colorado Springs,-104.8213634,38.8338816
311,2/18/17 19:00,Glendale Heights,IL,light,10 minutes,2017-02-18 19:00:00,600.0,2017-02-18 19:10:00,IL Glendale Heights,-88.0717353,41.9103068
312,2/18/17 19:00,Chanhassen (east of),MN,circle,5 minutes,2017-02-18 19:00:00,300.0,2017-02-18 19:05:00,MN Chanhassen (east of),-93.5323103,44.8619645
313,2/18/17 18:00,Glendale Heights,IL,light,10 minutes,2017-02-18 18:00:00,600.0,2017-02-18 18:10:00,IL Glendale Heights,-88.0717353,41.9103068
314,2/18/17 18:00,Hartford,ME,light,6 minutes,2017-02-18 18:00:00,360.0,2017-02-18 18:06:00,ME Hartford,-70.346726,44.372845
315,2/18/17 17:00,Massena,NY,cylinder,20 minutes,2017-02-18 17:00:00,1200.0,2017-02-18 17:20:00,NY Massena,-74.891865,44.9281049
318,2/18/17 03:00,Raymore,MO,flash,10-20 sec,2017-02-18 03:00:00,20.0,2017-02-18 03:00:20,MO Raymore,-94.4527294,38.801953
319,2/18/17 00:00,Gettysburg,PA,circle,3 seconds,2017-02-18 00:00:00,3.0,2017-02-18 00:00:03,PA Gettysburg,-77.2310955,39.8309293
320,2/17/17 23:50,Tacoma,WA,formation,6 seconds,2017-02-17 23:50:00,6.0,2017-02-17 23:50:06,WA Tacoma,-122.4442906,47.2528768
321,2/17/17 23:27,Millvale,PA,fireball,5 seconds,2017-02-17 23:27:00,5.0,2017-02-17 23:27:05,PA Millvale,-79.9783862,40.480069
322,2/17/17 23:20,Billings,MT,circle,5 minutes,2017-02-17 23:20:00,300.0,2017-02-17 23:25:00,MT Billings,-108.5006904,45.7832856
323,2/17/17 23:00,Osceola,IN,unknown,1 hour +,2017-02-17 23:00:00,3600.0,2017-02-18 00:00:00,IN Osceola,-86.075836,41.6650487
324,2/17/17 22:15,Moon Township/clinton,PA,fireball,10 seconds,2017-02-17 22:15:00,10.0,2017-02-17 22:15:10,PA Moon Township/clinton,-80.2720981,40.5070688
325,2/17/17 20:40,Irving,TX,light,20 minutes,2017-02-17 20:40:00,1200.0,2017-02-17 21:00:00,TX Irving,-96.9488945,32.8140177
327,2/17/17 20:07,Fairbanks,AK,circle,8 minutes + -,2017-02-17 20:07:00,480.0,2017-02-17 20:15:00,AK Fairbanks,-147.7163889,64.8377778
328,2/17/17 20:03,Troy,MI,cylinder,>1 hour,2017-02-17 20:03:00,3600.0,2017-02-17 21:03:00,MI Troy,-83.1497751,42.6064095
329,2/17/17 19:00,"Panama city beach,east",FL,fireball,4.17 minutes,2017-02-17 19:00:00,1020.0,2017-02-17 19:17:00,"FL Panama city beach,east",-85.8124018,30.1795257
330,2/17/17 18:45,Longmont,CO,oval,5 minutes,2017-02-17 18:45:00,300.0,2017-02-17 18:50:00,CO Longmont,-105.1019275,40.1672068
331,2/17/17 18:00,Edmonton (Canada),AB,light,20 minutes,2017-02-17 18:00:00,1200.0,2017-02-17 18:20:00,AB Edmonton (Canada),-113.4909267,53.544389
332,2/17/17 15:20,Florence,SC,oval,1 minute,2017-02-17 15:20:00,60.0,2017-02-17 15:21:00,SC Florence,-79.7625625,34.1954331
333,2/17/17 08:30,Bryan,TX,oval,45 seconds,2017-02-17 08:30:00,45.0,2017-02-17 08:30:45,TX Bryan,-96.3699632,30.6743643
334,2/16/17 23:30,Johnson City,NY,oval,2 seconds,2017-02-16 23:30:00,2.0,2017-02-16 23:30:02,NY Johnson City,-75.9588092,42.1156308
335,2/16/17 21:00,Longview,TX,light,2 hours,2017-02-16 21:00:00,7200.0,2017-02-16 23:00:00,TX Longview,-94.7404891,32.5007037
336,2/16/17 20:45,Indio,CA,sphere,5 minutes,2017-02-16 20:45:00,300.0,2017-02-16 20:50:00,CA Indio,-116.2155619,33.7205771
338,2/16/17 20:00,Social Circle,GA,triangle,5 minutes,2017-02-16 20:00:00,300.0,2017-02-16 20:05:00,GA Social Circle,-83.718231,33.656228
340,2/16/17 19:48,Bartlesville,OK,formation,30 seconds,2017-02-16 19:48:00,30.0,2017-02-16 19:48:30,OK Bartlesville,-95.9808179,36.7473114
342,2/16/17 19:00,Mt. Orab,OH,fireball,15 minutes,2017-02-16 19:00:00,900.0,2017-02-16 19:15:00,OH Mt. Orab,-83.919652,39.0275659
343,2/16/17 18:30,Grifton,NC,other,10 seconds,2017-02-16 18:30:00,10.0,2017-02-16 18:30:10,NC Grifton,-77.4374641,35.3726629
345,2/16/17 17:09,Winterville,NC,sphere,1 minute,2017-02-16 17:09:00,60.0,2017-02-16 17:10:00,NC Winterville,-77.4010762,35.529051
346,2/16/17 16:30,Paducah,KY,cigar,<1 minute,2017-02-16 16:30:00,60.0,2017-02-16 16:31:00,KY Paducah,-88.6000478,37.0833893
347,2/16/17 16:30,Grifton,NC,sphere,1 minute,2017-02-16 16:30:00,60.0,2017-02-16 16:31:00,NC Grifton,-77.4374641,35.3726629
348,2/16/17 16:00,Wichita,KS,other,2 minutes,2017-02-16 16:00:00,120.0,2017-02-16 16:02:00,KS Wichita,-97.330053,37.6871761
349,2/16/17 10:30,Camarillo,CA,light,15 minutes,2017-02-16 10:30:00,900.0,2017-02-16 10:45:00,CA Camarillo,-119.0376023,34.2163937
350,2/16/17 07:18,Maycomb,AL,disk,1 minute,2017-02-16 07:18:00,60.0,2017-02-16 07:19:00,AL Maycomb,-87.3247077,31.5279399
352,2/16/17 07:00,Yuma,AZ,light,1 minute,2017-02-16 07:00:00,60.0,2017-02-16 07:01:00,AZ Yuma,-114.6276916,32.6926512
353,2/16/17 06:15,Bushkill,PA,light,1 hour,2017-02-16 06:15:00,3600.0,2017-02-16 07:15:00,PA Bushkill,-75.0018401,41.093429
354,2/15/17 23:15,The Villages,FL,light,15 minutes,2017-02-15 23:15:00,900.0,2017-02-15 23:30:00,FL The Villages,-82.0037608,28.927019
355,2/15/17 22:00,National City,CA,light,>5-10 minutes,2017-02-15 22:00:00,600.0,2017-02-15 22:10:00,CA National City,-117.0991967,32.6781085
356,2/15/17 21:12,Hopulikit,GA,light,15-20 seconds,2017-02-15 21:12:00,20.0,2017-02-15 21:12:20,GA Hopulikit,-81.8503916,32.5215587
359,2/15/17 20:30,Lava Hot Springs,ID,light,1-2 hours,2017-02-15 20:30:00,7200.0,2017-02-15 22:30:00,ID Lava Hot Springs,-112.0110712,42.6193625
361,2/15/17 20:00,Austin,NV,triangle,3 minutes,2017-02-15 20:00:00,180.0,2017-02-15 20:03:00,NV Austin,-117.0672356,39.4925701
362,2/15/17 20:00,Jersey City,NJ,sphere,~3 hours,2017-02-15 20:00:00,10800.0,2017-02-15 23:00:00,NJ Jersey City,-74.0776417,40.7281575
365,2/15/17 19:50,Chillicothe,OH,unknown,5 minutes,2017-02-15 19:50:00,300.0,2017-02-15 19:55:00,OH Chillicothe,-82.9824019,39.3331197
366,2/15/17 19:50,Harper,TX,light,~6 seconds,2017-02-15 19:50:00,6.0,2017-02-15 19:50:06,TX Harper,-99.2442144,30.2999195
368,2/15/17 19:50,Harper,TX,light,10 seconds,2017-02-15 19:50:00,10.0,2017-02-15 19:50:10,TX Harper,-99.2442144,30.2999195
369,2/15/17 19:40,Bethel,OH,light,25 seconds,2017-02-15 19:40:00,25.0,2017-02-15 19:40:25,OH Bethel,-84.0807664,38.9636771
371,2/15/17 19:00,Wichita,KS,circle,1 minute each,2017-02-15 19:00:00,60.0,2017-02-15 19:01:00,KS Wichita,-97.330053,37.6871761
372,2/15/17 18:48,Cape Girardeau,MO,light,5 minutes,2017-02-15 18:48:00,300.0,2017-02-15 18:53:00,MO Cape Girardeau,-89.5181476,37.3058839
373,2/15/17 09:50,Algood,TN,egg,5 seconds,2017-02-15 09:50:00,5.0,2017-02-15 09:50:05,TN Algood,-85.4485849,36.1958946
375,2/15/17,Strathmore (Canada),AB,unknown,90 minutes,2017-02-15 00:00:00,5400.0,2017-02-15 01:30:00,AB Strathmore (Canada),-113.4002873,51.0378523
376,2/14/17 22:00,Redlands,CA,changing,30 minutes,2017-02-14 22:00:00,1800.0,2017-02-14 22:30:00,CA Redlands,-117.1825381,34.0555693
377,2/14/17 21:00,Torrance,CA,light,3 minutes,2017-02-14 21:00:00,180.0,2017-02-14 21:03:00,CA Torrance,-118.3406288,33.8358492
378,2/14/17 20:00,Claremont,CA,other,7 seconds,2017-02-14 20:00:00,7.0,2017-02-14 20:00:07,CA Claremont,-117.7197785,34.0966764
379,2/14/17 19:35,Bethlehem,PA,fireball,2 minutes,2017-02-14 19:35:00,120.0,2017-02-14 19:37:00,PA Bethlehem,-75.3704579,40.6259316
380,2/14/17 19:30,Vancouver,WA,triangle,10 seconds,2017-02-14 19:30:00,10.0,2017-02-14 19:30:10,WA Vancouver,-122.6716063,45.6318397
382,2/14/17 06:32,Los Angeles,CA,light,15 seconds,2017-02-14 06:32:00,15.0,2017-02-14 06:32:15,CA Los Angeles,-118.2436849,34.0522342
383,2/14/17 06:20,Auburn,NY,other,10 minutes,2017-02-14 06:20:00,600.0,2017-02-14 06:30:00,NY Auburn,-76.5660529,42.9317335
384,2/14/17 06:20,Pioneer,CA,sphere,1 minute,2017-02-14 06:20:00,60.0,2017-02-14 06:21:00,CA Pioneer,-120.5718719,38.4318551
385,2/14/17 06:20,Roseville,CA,light,2 minutes,2017-02-14 06:20:00,120.0,2017-02-14 06:22:00,CA Roseville,-121.2880059,38.7521235
386,2/14/17 06:20,Turlock,CA,light,15-20 seconds,2017-02-14 06:20:00,20.0,2017-02-14 06:20:20,CA Turlock,-120.8465941,37.4946568
388,2/14/17 06:15,Hollister,CA,light,4 minutes,2017-02-14 06:15:00,240.0,2017-02-14 06:19:00,CA Hollister,-121.4016021,36.8524545
389,2/14/17 03:30,Stafford,VA,light,1 hour,2017-02-14 03:30:00,3600.0,2017-02-14 04:30:00,VA Stafford,-77.4242972,38.4334566
390,2/14/17 01:15,Kelso,WA,light,13 minutes,2017-02-14 01:15:00,780.0,2017-02-14 01:28:00,WA Kelso,-122.9084445,46.146779
391,2/14/17 01:00,Lexington,KY,oval,30 seconds,2017-02-14 01:00:00,30.0,2017-02-14 01:00:30,KY Lexington,-84.5037164,38.0405837
392,2/13/17 23:00,Morton,IL,circle,30 seconds,2017-02-13 23:00:00,30.0,2017-02-13 23:00:30,IL Morton,-89.4592609,40.6128161
393,2/13/17 22:00,Alcester,SD,sphere,30 minutes,2017-02-13 22:00:00,1800.0,2017-02-13 22:30:00,SD Alcester,-96.6308708,43.0213783
394,2/13/17 22:00,Franklin,NH,triangle,30 minutes,2017-02-13 22:00:00,1800.0,2017-02-13 22:30:00,NH Franklin,-71.6472988,43.4442432
395,2/13/17 21:30,West Union,IA,chevron,10 minutes,2017-02-13 21:30:00,600.0,2017-02-13 21:40:00,IA West Union,-91.8082167,42.9627564
396,2/13/17 21:30,Concord - Penecook,NH,fireball,30-45 seconds,2017-02-13 21:30:00,45.0,2017-02-13 21:30:45,NH Concord - Penecook,-71.6002039,43.280373
397,2/13/17 21:15,Highlands,NC,sphere,15-25 minutes,2017-02-13 21:15:00,1500.0,2017-02-13 21:40:00,NC Highlands,-83.1968173,35.0525909
398,2/13/17 21:15,New York City,NY,light,4 seconds,2017-02-13 21:15:00,4.0,2017-02-13 21:15:04,NY New York City,-74.0059413,40.7127837
399,2/13/17 21:10,Wall,NJ,fireball,30 seconds,2017-02-13 21:10:00,30.0,2017-02-13 21:10:30,NJ Wall,-74.0679753,40.1606666
400,2/13/17 21:05,Franklin,MA,sphere,3 seconds,2017-02-13 21:05:00,3.0,2017-02-13 21:05:03,MA Franklin,-71.396725,42.0834313
401,2/13/17 21:00,Ludlow,KY,sphere,15 minutes and ongoing,2017-02-13 21:00:00,900.0,2017-02-13 21:15:00,KY Ludlow,-84.5474435,39.0925597
403,2/13/17 20:00,Capitola,CA,sphere,>15 minutes,2017-02-13 20:00:00,900.0,2017-02-13 20:15:00,CA Capitola,-121.953293,36.9752283
404,2/13/17 20:00,Medina,OH,rectangle,1 minute,2017-02-13 20:00:00,60.0,2017-02-13 20:01:00,OH Medina,-81.8552196,41.143245
405,2/13/17 19:30,Mt. Orab,OH,light,5 minutes,2017-02-13 19:30:00,300.0,2017-02-13 19:35:00,OH Mt. Orab,-83.919652,39.0275659
406,2/13/17 18:40,Brick,NJ,light,3 minutes,2017-02-13 18:40:00,180.0,2017-02-13 18:43:00,NJ Brick,-74.1371832,40.0578384
408,2/13/17 01:08,Detroit,MI,triangle,45 seconds,2017-02-13 01:08:00,45.0,2017-02-13 01:08:45,MI Detroit,-83.0457538,42.331427
410,2/12/17 22:53,Richland,WA,circle,1 minute,2017-02-12 22:53:00,60.0,2017-02-12 22:54:00,WA Richland,-119.2844621,46.2856907
412,2/12/17 21:30,Mokuliea,HI,changing,20 minutes,2017-02-12 21:30:00,1200.0,2017-02-12 21:50:00,HI Mokuliea,-158.2065004,21.5766372
415,2/12/17 20:30,Peoria,AZ,circle,1 hour,2017-02-12 20:30:00,3600.0,2017-02-12 21:30:00,AZ Peoria,-112.2373779,33.5805955
416,2/12/17 20:00,Winter Haven,FL,circle,~10 minutes,2017-02-12 20:00:00,600.0,2017-02-12 20:10:00,FL Winter Haven,-81.7328567,28.0222435
417,2/12/17 19:00,Novelty,OH,diamond,7 minutes,2017-02-12 19:00:00,420.0,2017-02-12 19:07:00,OH Novelty,-81.3509416,41.4651134
418,2/12/17 19:00,Wausau,WI,light,2+ hours still going,2017-02-12 19:00:00,7200.0,2017-02-12 21:00:00,WI Wausau,-89.6301221,44.9591352
419,2/12/17 19:00,King,NC,sphere,~2 hours,2017-02-12 19:00:00,7200.0,2017-02-12 21:00:00,NC King,-80.3592197,36.2806939
420,2/12/17 18:45,Saint Paul,MN,circle,>3 hours,2017-02-12 18:45:00,10800.0,2017-02-12 21:45:00,MN Saint Paul,-93.0899578,44.9537029
421,2/12/17 18:37,Orland Park,IL,unknown,30 seconds,2017-02-12 18:37:00,30.0,2017-02-12 18:37:30,IL Orland Park,-87.8539425,41.6303103
422,2/12/17 15:45,Torrance,CA,light,10 minutes,2017-02-12 15:45:00,600.0,2017-02-12 15:55:00,CA Torrance,-118.3406288,33.8358492
423,2/12/17 15:00,Valencia,CA,triangle,3-4 minutes,2017-02-12 15:00:00,240.0,2017-02-12 15:04:00,CA Valencia,-118.5713823,34.456151
424,2/12/17 08:30,Winter Springs,FL,cigar,60 seconds,2017-02-12 08:30:00,60.0,2017-02-12 08:31:00,FL Winter Springs,-81.3081226,28.6988853
425,2/12/17 02:45,Lithia,FL,fireball,4 seconds,2017-02-12 02:45:00,4.0,2017-02-12 02:45:04,FL Lithia,-82.1496049,27.8187623
426,2/12/17 02:03,Fredericton (Canada),NB,changing,15 minutes,2017-02-12 02:03:00,900.0,2017-02-12 02:18:00,NB Fredericton (Canada),-66.6431151,45.9635895
428,2/12/17 01:25,Rancho Palos Verdes,CA,triangle,4 minutes,2017-02-12 01:25:00,240.0,2017-02-12 01:29:00,CA Rancho Palos Verdes,-118.3870173,33.7444613
430,2/11/17 21:00,Fuquay-Varina,NC,circle,5 minutes,2017-02-11 21:00:00,300.0,2017-02-11 21:05:00,NC Fuquay-Varina,-78.8000128,35.5843235
431,2/11/17 20:00,Stevensville,MT,light,10 minutes,2017-02-11 20:00:00,600.0,2017-02-11 20:10:00,MT Stevensville,-114.0931588,46.5099225
432,2/11/17 19:38,Sarasota,FL,circle,5 minutes,2017-02-11 19:38:00,300.0,2017-02-11 19:43:00,FL Sarasota,-82.5306527,27.3364347
433,2/11/17 19:09,Amite,LA,circle,25 min.,2017-02-11 19:09:00,1500.0,2017-02-11 19:34:00,LA Amite,-90.5089815,30.7265747
434,2/11/17 19:09,Amite,LA,circle,25 minutes,2017-02-11 19:09:00,1500.0,2017-02-11 19:34:00,LA Amite,-90.5089815,30.7265747
435,2/11/17 19:00,Saint Petersburg,FL,light,4 minutes,2017-02-11 19:00:00,240.0,2017-02-11 19:04:00,FL Saint Petersburg,-82.6267345,27.7518284
436,2/11/17 19:00,Saint Petersburg,FL,light,4 minutes,2017-02-11 19:00:00,240.0,2017-02-11 19:04:00,FL Saint Petersburg,-82.6267345,27.7518284
437,2/11/17 18:35,Bozeman,MT,other,5-7 minutes,2017-02-11 18:35:00,420.0,2017-02-11 18:42:00,MT Bozeman,-111.0429339,45.6769979
438,2/11/17 18:31,Lawrence,KS,triangle,5 minutes,2017-02-11 18:31:00,300.0,2017-02-11 18:36:00,KS Lawrence,-95.2352501,38.9716689
439,2/11/17 17:20,Summerdale,AL,light,30 seconds to 1 minute,2017-02-11 17:20:00,30.0,2017-02-11 17:20:30,AL Summerdale,-87.6997094,30.4876954
440,2/11/17 15:00,Pasadena,MD,triangle,2 minutes,2017-02-11 15:00:00,120.0,2017-02-11 15:02:00,MD Pasadena,-76.5710753,39.1073317
441,2/11/17 14:45,Ames,IA,triangle,3 seconds,2017-02-11 14:45:00,3.0,2017-02-11 14:45:03,IA Ames,-93.6319131,42.0307812
442,2/11/17 01:00,Port Orchard,WA,formation,2 hours,2017-02-11 01:00:00,7200.0,2017-02-11 03:00:00,WA Port Orchard,-122.6362492,47.5403732
443,2/10/17 19:15,Hurdle Mills,NC,unknown,30 minutes,2017-02-10 19:15:00,1800.0,2017-02-10 19:45:00,NC Hurdle Mills,-79.0475115,36.2731957
444,2/10/17 19:05,Duluth,GA,cylinder,1 minute,2017-02-10 19:05:00,60.0,2017-02-10 19:06:00,GA Duluth,-84.1446376,34.0028786
445,2/10/17 18:35,New Kent,VA,light,2 minutes,2017-02-10 18:35:00,120.0,2017-02-10 18:37:00,VA New Kent,-76.964306,37.4653757
447,2/10/17 15:00,Eagan,MN,unknown,5 minutes,2017-02-10 15:00:00,300.0,2017-02-10 15:05:00,MN Eagan,-93.1668858,44.8041322
448,2/10/17 10:15,Howell,MI,fireball,15 minutes,2017-02-10 10:15:00,900.0,2017-02-10 10:30:00,MI Howell,-83.9293952,42.6072552
449,2/9/17 22:15,Norton,VA,unknown,60 seconds,2017-02-09 22:15:00,60.0,2017-02-09 22:16:00,VA Norton,-82.6290459,36.933433
450,2/9/17 20:00,Johnson City,TN,circle,1 hour,2017-02-09 20:00:00,3600.0,2017-02-09 21:00:00,TN Johnson City,-82.3534727,36.3134397
451,2/9/17 18:00,Bridgeton,MO,formation,5 minutes,2017-02-09 18:00:00,300.0,2017-02-09 18:05:00,MO Bridgeton,-90.4115057,38.7669954
452,2/9/17 10:40,Red Bank,NJ,flash,2 minutes +,2017-02-09 10:40:00,120.0,2017-02-09 10:42:00,NJ Red Bank,-74.0643065,40.3470543
454,2/9/17 03:20,Fredericksburg,VA,disk,4.5 minutes,2017-02-09 03:20:00,300.0,2017-02-09 03:25:00,VA Fredericksburg,-77.4605399,38.3031837
455,2/9/17 00:00,Columbia,CT,fireball,2 hours,2017-02-09 00:00:00,7200.0,2017-02-09 02:00:00,CT Columbia,-72.3011917,41.7020432
457,2/8/17 22:30,Tucson,AZ,unknown,10 minutes,2017-02-08 22:30:00,600.0,2017-02-08 22:40:00,AZ Tucson,-110.926479,32.2217429
458,2/8/17 21:30,Kirkland,IL,light,10 seconds,2017-02-08 21:30:00,10.0,2017-02-08 21:30:10,IL Kirkland,-88.8512063,42.0925258
459,2/8/17 21:30,Avondale,AZ,light,5-10 minutes,2017-02-08 21:30:00,600.0,2017-02-08 21:40:00,AZ Avondale,-112.3496021,33.4355977
460,2/8/17 20:45,Naples,FL,light,1 hour,2017-02-08 20:45:00,3600.0,2017-02-08 21:45:00,FL Naples,-81.7948103,26.1420358
461,2/8/17 20:40,North Myrtle Beach,SC,light,10 minutes,2017-02-08 20:40:00,600.0,2017-02-08 20:50:00,SC North Myrtle Beach,-78.680016,33.8160058
462,2/8/17 20:35,Espanola,NM,sphere,15 minutes,2017-02-08 20:35:00,900.0,2017-02-08 20:50:00,NM Espanola,-106.0818233,35.9910383
463,2/8/17 20:35,Espanola,NM,sphere,15 minutes,2017-02-08 20:35:00,900.0,2017-02-08 20:50:00,NM Espanola,-106.0818233,35.9910383
466,2/8/17 06:00,Lloydminster (Canada),AB,fireball,5 minutes,2017-02-08 06:00:00,300.0,2017-02-08 06:05:00,AB Lloydminster (Canada),-110.0061451,53.2779625
467,2/8/17 05:30,Liberty Hill,TX,oval,2 minutes,2017-02-08 05:30:00,120.0,2017-02-08 05:32:00,TX Liberty Hill,-97.9225161,30.6649119
468,2/8/17 03:00,Tallahassee,FL,changing,1-2 minutes,2017-02-08 03:00:00,120.0,2017-02-08 03:02:00,FL Tallahassee,-84.2807329,30.4382559
469,2/7/17 23:15,Land O'Lakes,FL,light,1 minute,2017-02-07 23:15:00,60.0,2017-02-07 23:16:00,FL Land O'Lakes,-82.4575938,28.2188992
470,2/7/17 21:47,Bay St. Louis,MS,oval,3 minutes,2017-02-07 21:47:00,180.0,2017-02-07 21:50:00,MS Bay St. Louis,-89.3300461,30.3088076
471,2/7/17 21:30,Tucson,AZ,other,2-5 minutes,2017-02-07 21:30:00,300.0,2017-02-07 21:35:00,AZ Tucson,-110.926479,32.2217429
472,2/7/17 21:30,Nampa,ID,triangle,50 minutes,2017-02-07 21:30:00,3000.0,2017-02-07 22:20:00,ID Nampa,-116.5634624,43.5407172
473,2/7/17 21:29,Melba,ID,oval,18 minutes,2017-02-07 21:29:00,1080.0,2017-02-07 21:47:00,ID Melba,-116.5290116,43.3754405
475,2/7/17 20:00,Port Orchard,WA,cone,2 minutes,2017-02-07 20:00:00,120.0,2017-02-07 20:02:00,WA Port Orchard,-122.6362492,47.5403732
476,2/7/17 19:45,Port Orchard,WA,light,20 seconds,2017-02-07 19:45:00,20.0,2017-02-07 19:45:20,WA Port Orchard,-122.6362492,47.5403732
477,2/7/17 19:20,Macon,GA,other,2 minutes,2017-02-07 19:20:00,120.0,2017-02-07 19:22:00,GA Macon,-83.6324022,32.8406946
478,2/7/17 19:20,Macon,GA,other,2 minutes,2017-02-07 19:20:00,120.0,2017-02-07 19:22:00,GA Macon,-83.6324022,32.8406946
480,2/7/17 11:15,Huntington,WV,circle,5 minutes,2017-02-07 11:15:00,300.0,2017-02-07 11:20:00,WV Huntington,-82.445154,38.4192496
481,2/6/17 22:50,Arnold,PA,unknown,15 minutes,2017-02-06 22:50:00,900.0,2017-02-06 23:05:00,PA Arnold,-79.7667151,40.5800669
482,2/6/17 22:30,Albuquerque,NM,disk,<1 minute,2017-02-06 22:30:00,60.0,2017-02-06 22:31:00,NM Albuquerque,-106.6055534,35.0853336
483,2/6/17 21:00,St. Petersburg,FL,other,3-4 minutes,2017-02-06 21:00:00,240.0,2017-02-06 21:04:00,FL St. Petersburg,-82.6267345,27.7518284
485,2/6/17 20:15,Salisbury,MD,other,10 seconds,2017-02-06 20:15:00,10.0,2017-02-06 20:15:10,MD Salisbury,-75.5993692,38.3606736
486,2/6/17 18:09,"Panama City Beach,  gulf",FL,cigar,15 seconds,2017-02-06 18:09:00,15.0,2017-02-06 18:09:15,"FL Panama City Beach,  gulf",-85.8671863,30.2111627
487,2/6/17 18:00,Portland,OR,light,1 hour,2017-02-06 18:00:00,3600.0,2017-02-06 19:00:00,OR Portland,-122.6764816,45.5230622
488,2/6/17 04:22,Port Orchard,WA,unknown,4 seconds,2017-02-06 04:22:00,4.0,2017-02-06 04:22:04,WA Port Orchard,-122.6362492,47.5403732
489,2/6/17 02:35,Whitehall,MI,flash,10 seconds,2017-02-06 02:35:00,10.0,2017-02-06 02:35:10,MI Whitehall,-86.3486792,43.4100107
490,2/6/17 02:30,Minneapolis,MN,light,2 seconds,2017-02-06 02:30:00,2.0,2017-02-06 02:30:02,MN Minneapolis,-93.2650108,44.977753
492,2/6/17 02:00,Millmont,PA,light,1-2 minutes,2017-02-06 02:00:00,120.0,2017-02-06 02:02:00,PA Millmont,-77.1411474,40.8845903
493,2/6/17 01:15,Oak Lawn,IL,fireball,6-7 seconds,2017-02-06 01:15:00,7.0,2017-02-06 01:15:07,IL Oak Lawn,-87.7479528,41.719978
495,2/6/17 00:10,Lancaster,PA,sphere,~1 second,2017-02-06 00:10:00,1.0,2017-02-06 00:10:01,PA Lancaster,-76.3055144,40.0378755
496,2/5/17 23:25,Athens,MI,triangle,10 minutes,2017-02-05 23:25:00,600.0,2017-02-05 23:35:00,MI Athens,-85.2347051,42.0886576
498,2/5/17 22:30,Rivera Maya,NM,light,10 minutes,2017-02-05 22:30:00,600.0,2017-02-05 22:40:00,NM Rivera Maya,-87.21539,20.506925
499,2/5/17 22:05,Chicago,IL,circle,15 minutes,2017-02-05 22:05:00,900.0,2017-02-05 22:20:00,IL Chicago,-87.6297982,41.8781136
500,2/5/17 21:48,Carmine,TX,sphere,15 seconds,2017-02-05 21:48:00,15.0,2017-02-05 21:48:15,TX Carmine,-96.6860862,30.1493838
501,2/5/17 21:30,Village of Caledonia,WI,changing,1.5 hours+,2017-02-05 21:30:00,18000.0,2017-02-06 02:30:00,WI Village of Caledonia,-87.924248,42.8077958
502,2/5/17 21:10,Saint John (Canada),NB,other,7 minutes,2017-02-05 21:10:00,420.0,2017-02-05 21:17:00,NB Saint John (Canada),-66.0633081,45.2733153
503,2/5/17 21:00,Clinton,TN,circle,1 minute,2017-02-05 21:00:00,60.0,2017-02-05 21:01:00,TN Clinton,-84.1318632,36.1034126
504,2/5/17 19:00,Bend,OR,formation,30 minutes,2017-02-05 19:00:00,1800.0,2017-02-05 19:30:00,OR Bend,-121.3153096,44.0581728
505,2/5/17 19:00,Santee,CA,circle,20 minutes,2017-02-05 19:00:00,1200.0,2017-02-05 19:20:00,CA Santee,-116.9739167,32.8383828
506,2/5/17 19:00,Manalapan,NJ,changing,2 hours,2017-02-05 19:00:00,7200.0,2017-02-05 21:00:00,NJ Manalapan,-74.348582,40.2859203
507,2/5/17 18:30,Clarksville,TN,oval,3 minute intervals,2017-02-05 18:30:00,180.0,2017-02-05 18:33:00,TN Clarksville,-87.3594528,36.5297706
509,2/5/17 01:35,Sahuarita,AZ,triangle,3 minutes,2017-02-05 01:35:00,180.0,2017-02-05 01:38:00,AZ Sahuarita,-110.955646,31.9575818
510,2/4/17 20:30,Miramar,FL,cylinder,30 minutes,2017-02-04 20:30:00,1800.0,2017-02-04 21:00:00,FL Miramar,-80.3035602,25.9860762
511,2/4/17 17:53,Queen Creek,AZ,changing,8 minutes,2017-02-04 17:53:00,480.0,2017-02-04 18:01:00,AZ Queen Creek,-111.6342993,33.2486638
512,2/4/17 17:00,Marshall,MN,sphere,7 seconds,2017-02-04 17:00:00,7.0,2017-02-04 17:00:07,MN Marshall,-95.7911916,44.448423
513,2/4/17 17:00,Somerville,MA,other,15 minutes,2017-02-04 17:00:00,900.0,2017-02-04 17:15:00,MA Somerville,-71.0994968,42.3875968
514,2/4/17 15:50,Cape May Court House,NJ,light,~10 minutes,2017-02-04 15:50:00,600.0,2017-02-04 16:00:00,NJ Cape May Court House,-74.8237786,39.0826135
515,2/4/17 03:24,Rancho Palos Verdes,CA,light,2 minutes,2017-02-04 03:24:00,120.0,2017-02-04 03:26:00,CA Rancho Palos Verdes,-118.3870173,33.7444613
517,2/3/17 21:35,Lake Worth,FL,circle,35 seconds,2017-02-03 21:35:00,35.0,2017-02-03 21:35:35,FL Lake Worth,-80.0684479,26.6167555
519,2/3/17 21:00,Hutto,TX,formation,2 seconds,2017-02-03 21:00:00,2.0,2017-02-03 21:00:02,TX Hutto,-97.5466702,30.5426995
520,2/3/17 20:33,Sarasota,FL,circle,4 minutes,2017-02-03 20:33:00,240.0,2017-02-03 20:37:00,FL Sarasota,-82.5306527,27.3364347
521,2/3/17 20:30,Louisville,KY,circle,20 minutes,2017-02-03 20:30:00,1200.0,2017-02-03 20:50:00,KY Louisville,-85.7584557,38.2526647
522,2/3/17 20:00,Gambrills,MD,light,1 hour,2017-02-03 20:00:00,3600.0,2017-02-03 21:00:00,MD Gambrills,-76.6654513,39.0670456
523,2/3/17 20:00,Phoenix,AZ,light,4 hours,2017-02-03 20:00:00,14400.0,2017-02-04 00:00:00,AZ Phoenix,-112.0740373,33.4483771
524,2/3/17 19:00,Flagler Beach,FL,triangle,5 minutes,2017-02-03 19:00:00,300.0,2017-02-03 19:05:00,FL Flagler Beach,-81.1270035,29.4749754
525,2/3/17 18:44,Flagler,FL,triangle,~2 minutes,2017-02-03 18:44:00,120.0,2017-02-03 18:46:00,FL Flagler,-81.2518833,29.4086072
526,2/3/17 18:35,Flagler Beach,FL,triangle,5-10 minutes,2017-02-03 18:35:00,600.0,2017-02-03 18:45:00,FL Flagler Beach,-81.1270035,29.4749754
527,2/3/17 17:30,Webster,WI,light,2 hours,2017-02-03 17:30:00,7200.0,2017-02-03 19:30:00,WI Webster,-92.3674164,45.8774469
528,2/3/17 10:23,St. Charles,MO,other,1 minute,2017-02-03 10:23:00,60.0,2017-02-03 10:24:00,MO St. Charles,-90.4974359,38.7881062
529,2/2/17 22:00,Howell,NJ,triangle,5 minutes,2017-02-02 22:00:00,300.0,2017-02-02 22:05:00,NJ Howell,-74.2082671,40.1645785
530,2/2/17 20:00,Mesa,AZ,light,20 seconds,2017-02-02 20:00:00,20.0,2017-02-02 20:00:20,AZ Mesa,-111.8314724,33.4151843
531,2/2/17 19:00,Kailua,HI,light,60 minutes,2017-02-02 19:00:00,3600.0,2017-02-02 20:00:00,HI Kailua,-157.7394444,21.4022222
532,2/2/17 18:30,Mobile,AL,fireball,1 hour,2017-02-02 18:30:00,3600.0,2017-02-02 19:30:00,AL Mobile,-88.0398912,30.6953657
533,2/2/17 12:45,Buffalo,NY,light,5 seconds,2017-02-02 12:45:00,5.0,2017-02-02 12:45:05,NY Buffalo,-78.8783689,42.8864468
534,2/2/17 01:35,Harrington,WA,oval,20 minutes,2017-02-02 01:35:00,1200.0,2017-02-02 01:55:00,WA Harrington,-118.2544187,47.4809872
536,2/1/17 23:43,Williamsville,NY,light,10 seconds,2017-02-01 23:43:00,10.0,2017-02-01 23:43:10,NY Williamsville,-78.7378091,42.963947
537,2/1/17 23:00,Dawsonville,GA,circle,2 hours,2017-02-01 23:00:00,7200.0,2017-02-02 01:00:00,GA Dawsonville,-84.1190804,34.4212052
538,2/1/17 22:50,Tempe,AZ,light,10 minutes,2017-02-01 22:50:00,600.0,2017-02-01 23:00:00,AZ Tempe,-111.9400054,33.4255104
539,2/1/17 22:15,Fort Leonard Wood,MO,disk,1 minute,2017-02-01 22:15:00,60.0,2017-02-01 22:16:00,MO Fort Leonard Wood,-92.1348413,37.7944939
542,2/1/17 20:00,Arvada,CO,formation,15 minutes,2017-02-01 20:00:00,900.0,2017-02-01 20:15:00,CO Arvada,-105.0874842,39.8027644
543,2/1/17 19:40,Azusa,CA,changing,40-60 seconds,2017-02-01 19:40:00,60.0,2017-02-01 19:41:00,CA Azusa,-117.9075627,34.1336186
545,2/1/17 18:25,West Seattle,WA,unknown,4 minutes,2017-02-01 18:25:00,240.0,2017-02-01 18:29:00,WA West Seattle,-122.3867537,47.5666668
546,2/1/17 17:46,New London,CT,chevron,35 seconds,2017-02-01 17:46:00,35.0,2017-02-01 17:46:35,CT New London,-72.0995209,41.3556539
547,2/1/17 17:30,Abington,MA,sphere,2 minutes,2017-02-01 17:30:00,120.0,2017-02-01 17:32:00,MA Abington,-70.9453218,42.1048228
551,2/1/17 06:00,Chicago,IL,light,2 hours,2017-02-01 06:00:00,7200.0,2017-02-01 08:00:00,IL Chicago,-87.6297982,41.8781136
552,2/1/17 05:05,Dubuque,IA,disk,3 seconds,2017-02-01 05:05:00,3.0,2017-02-01 05:05:03,IA Dubuque,-90.6645718,42.5005583
553,1/31/17 23:45,Richlands,NC,other,4 seconds,2017-01-31 23:45:00,4.0,2017-01-31 23:45:04,NC Richlands,-77.5466342,34.8993297
554,1/31/17 23:00,Maricopa,AZ,light,~5 minutes,2017-01-31 23:00:00,300.0,2017-01-31 23:05:00,AZ Maricopa,-112.4291464,33.2917968
555,1/31/17 22:15,Albany,OR,sphere,2 seconds,2017-01-31 22:15:00,2.0,2017-01-31 22:15:02,OR Albany,-123.1059282,44.6365107
557,1/31/17 18:40,Mechanicsburg,PA,light,3 minutes,2017-01-31 18:40:00,180.0,2017-01-31 18:43:00,PA Mechanicsburg,-77.0085876,40.2142565
560,1/30/17 21:50,Travelers Rest,SC,chevron,15 seconds,2017-01-30 21:50:00,15.0,2017-01-30 21:50:15,SC Travelers Rest,-82.4434548,34.9676167
562,1/30/17 18:45,Katy,TX,fireball,5 seconds,2017-01-30 18:45:00,5.0,2017-01-30 18:45:05,TX Katy,-95.8243956,29.7857853
565,1/30/17 02:30,Somersworth,NH,light,15 minutes,2017-01-30 02:30:00,900.0,2017-01-30 02:45:00,NH Somersworth,-70.8653372,43.2617503
566,1/29/17 23:00,Ft. Lauderdale,FL,fireball,20 minutes,2017-01-29 23:00:00,1200.0,2017-01-29 23:20:00,FL Ft. Lauderdale,-80.1373174,26.1224386
567,1/29/17 22:30,Conyers,GA,light,~5 minutes,2017-01-29 22:30:00,300.0,2017-01-29 22:35:00,GA Conyers,-84.0176904,33.6676103
568,1/29/17 21:00,Layton,UT,other,15 minutes,2017-01-29 21:00:00,900.0,2017-01-29 21:15:00,UT Layton,-111.9710529,41.0602216
569,1/29/17 20:15,Hurricane,UT,light,10 minutes,2017-01-29 20:15:00,600.0,2017-01-29 20:25:00,UT Hurricane,-113.2899484,37.1752607
570,1/29/17 20:00,Powell,TN,sphere,20 minutes,2017-01-29 20:00:00,1200.0,2017-01-29 20:20:00,TN Powell,-84.027655,36.0318578
571,1/29/17 19:35,Bountiful,UT,light,20 minutes,2017-01-29 19:35:00,1200.0,2017-01-29 19:55:00,UT Bountiful,-111.880771,40.8893895
572,1/29/17 19:30,Saint Petersburg,FL,sphere,30 minutes,2017-01-29 19:30:00,1800.0,2017-01-29 20:00:00,FL Saint Petersburg,-82.6267345,27.7518284
573,1/29/17 19:15,Walden,NY,formation,10 minutes,2017-01-29 19:15:00,600.0,2017-01-29 19:25:00,NY Walden,-74.1884806,41.5612048
574,1/29/17 19:00,Cohasset,MN,oval,5 minutes,2017-01-29 19:00:00,300.0,2017-01-29 19:05:00,MN Cohasset,-93.6221657,47.2640071
575,1/29/17 18:47,Atlanta,GA,light,45-60 seconds,2017-01-29 18:47:00,60.0,2017-01-29 18:48:00,GA Atlanta,-84.3879824,33.7489954
576,1/29/17 18:40,Merrimack,NH,light,10 seconds,2017-01-29 18:40:00,10.0,2017-01-29 18:40:10,NH Merrimack,-71.4948322,42.8678693
577,1/29/17 18:00,Clio,AL,light,1 minute,2017-01-29 18:00:00,60.0,2017-01-29 18:01:00,AL Clio,-85.6104972,31.7087753
578,1/29/17 15:00,Albuquerque,NM,other,40 minutes,2017-01-29 15:00:00,2400.0,2017-01-29 15:40:00,NM Albuquerque,-106.6055534,35.0853336
579,1/29/17 14:10,Oceanside,CA,circle,45 seconds,2017-01-29 14:10:00,45.0,2017-01-29 14:10:45,CA Oceanside,-117.3794834,33.1958696
580,1/29/17 10:34,Studio City,CA,light,3 minutes,2017-01-29 10:34:00,180.0,2017-01-29 10:37:00,CA Studio City,-118.3870991,34.1395597
582,1/28/17 23:54,Tucson,AZ,circle,1 seconds,2017-01-28 23:54:00,1.0,2017-01-28 23:54:01,AZ Tucson,-110.926479,32.2217429
583,1/28/17 23:30,Trinity,NC,teardrop,3 hours+,2017-01-28 23:30:00,10800.0,2017-01-29 02:30:00,NC Trinity,-79.9908729,35.894581
584,1/28/17 23:30,Greenville,NC,circle,10-20 minutes,2017-01-28 23:30:00,1200.0,2017-01-28 23:50:00,NC Greenville,-77.3663538,35.612661
586,1/28/17 23:00,Grover,FL,disk,5 minutes,2017-01-28 23:00:00,300.0,2017-01-28 23:05:00,FL Grover,-80.6996989,28.2296219
587,1/28/17 22:30,Boca Raton,FL,light,15 minutes,2017-01-28 22:30:00,900.0,2017-01-28 22:45:00,FL Boca Raton,-80.1289321,26.3683064
589,1/28/17 20:50,Sahuarita,AZ,formation,~6 minutes,2017-01-28 20:50:00,360.0,2017-01-28 20:56:00,AZ Sahuarita,-110.955646,31.9575818
590,1/28/17 20:29,Chardon,OH,light,2-3 minutes,2017-01-28 20:29:00,180.0,2017-01-28 20:32:00,OH Chardon,-81.2133262,41.5786639
591,1/28/17 20:20,Chandler,AZ,light,3 minutes,2017-01-28 20:20:00,180.0,2017-01-28 20:23:00,AZ Chandler,-111.8412502,33.3061605
593,1/28/17 18:50,Ft. Lauderdale,FL,fireball,3 minutes,2017-01-28 18:50:00,180.0,2017-01-28 18:53:00,FL Ft. Lauderdale,-80.1373174,26.1224386
594,1/28/17 18:30,Londonderry/Hudson,NH,disk,30 minutes,2017-01-28 18:30:00,1800.0,2017-01-28 19:00:00,NH Londonderry/Hudson,-71.4398074,42.7647763
595,1/28/17 18:30,Scottsdale,AZ,triangle,5 minutes,2017-01-28 18:30:00,300.0,2017-01-28 18:35:00,AZ Scottsdale,-111.9260519,33.4941704
596,1/28/17 17:15,Waunakee,WI,unknown,1 minute,2017-01-28 17:15:00,60.0,2017-01-28 17:16:00,WI Waunakee,-89.4556749,43.1919373
598,1/28/17 05:00,Porterville,CA,circle,5 minutes,2017-01-28 05:00:00,300.0,2017-01-28 05:05:00,CA Porterville,-119.0167679,36.06523
599,1/28/17 03:54,Reno,NV,unknown,15 minutes,2017-01-28 03:54:00,900.0,2017-01-28 04:09:00,NV Reno,-119.8138027,39.5296329
600,1/28/17 00:10,Jenks,OK,circle,3 minutes,2017-01-28 00:10:00,180.0,2017-01-28 00:13:00,OK Jenks,-95.9683278,36.0228734
601,1/27/17 22:45,Mays Landing,NJ,teardrop,2 seconds,2017-01-27 22:45:00,2.0,2017-01-27 22:45:02,NJ Mays Landing,-74.7276626,39.4523385
606,1/27/17 20:00,Russellville,AR,light,35-45 seconds,2017-01-27 20:00:00,45.0,2017-01-27 20:00:45,AR Russellville,-93.1337856,35.2784173
609,1/27/17 19:15,Wendell,NC,light,15 seconds,2017-01-27 19:15:00,15.0,2017-01-27 19:15:15,NC Wendell,-78.3697213,35.780987
610,1/27/17 17:30,Farmington/New Durham,NH,circle,5 seconds,2017-01-27 17:30:00,5.0,2017-01-27 17:30:05,NH Farmington/New Durham,-71.1722886,43.4367466
611,1/27/17 16:45,Las Cruces,NM,formation,1 minute,2017-01-27 16:45:00,60.0,2017-01-27 16:46:00,NM Las Cruces,-106.7636538,32.3199396
612,1/27/17 13:15,Portland,OR,cylinder,15 minutes,2017-01-27 13:15:00,900.0,2017-01-27 13:30:00,OR Portland,-122.6764816,45.5230622
613,1/27/17 07:00,Potomac,MD,light,3 minutes,2017-01-27 07:00:00,180.0,2017-01-27 07:03:00,MD Potomac,-77.2085914,39.0181651
614,1/27/17 02:45,Selma,TX,fireball,<1 second,2017-01-27 02:45:00,1.0,2017-01-27 02:45:01,TX Selma,-98.3058463,29.5843948
615,1/27/17 01:30,New York City (Brooklyn),NY,fireball,30 minutes,2017-01-27 01:30:00,1800.0,2017-01-27 02:00:00,NY New York City (Brooklyn),-73.9441579,40.6781784
616,1/26/17 22:35,Hillsborough,NC,other,5 minutes,2017-01-26 22:35:00,300.0,2017-01-26 22:40:00,NC Hillsborough,-79.0997347,36.0754183
617,1/26/17 21:30,Encinitas,CA,fireball,1 minute,2017-01-26 21:30:00,60.0,2017-01-26 21:31:00,CA Encinitas,-117.2919818,33.0369867
619,1/26/17 20:00,Georgetown,SC,flash,30 minutes,2017-01-26 20:00:00,1800.0,2017-01-26 20:30:00,SC Georgetown,-79.2944964,33.376834
620,1/26/17 20:00,Georgetown,SC,circle,30 minutes,2017-01-26 20:00:00,1800.0,2017-01-26 20:30:00,SC Georgetown,-79.2944964,33.376834
622,1/26/17 19:00,Phenix City,AL,unknown,3-5 seconds,2017-01-26 19:00:00,5.0,2017-01-26 19:00:05,AL Phenix City,-85.0007653,32.4709761
623,1/26/17 18:54,Towson,MD,cigar,15 minutes,2017-01-26 18:54:00,900.0,2017-01-26 19:09:00,MD Towson,-76.6019125,39.4014955
624,1/26/17 18:50,Leesburg,VA,fireball,2 seconds,2017-01-26 18:50:00,2.0,2017-01-26 18:50:02,VA Leesburg,-77.5636015,39.1156615
625,1/26/17 18:30,Henrico,VA,chevron,7 seconds,2017-01-26 18:30:00,7.0,2017-01-26 18:30:07,VA Henrico,-77.3324425,37.5059332
630,1/26/17 13:00,Atlanta,GA,light,20 minutes,2017-01-26 13:00:00,1200.0,2017-01-26 13:20:00,GA Atlanta,-84.3879824,33.7489954
631,1/26/17 12:40,Greensboro,NC,other,35 minutes,2017-01-26 12:40:00,2100.0,2017-01-26 13:15:00,NC Greensboro,-79.8098429,36.0674908
632,1/25/17 22:45,Hernando,FL,light,1 minute,2017-01-25 22:45:00,60.0,2017-01-25 22:46:00,FL Hernando,-82.3745401,28.8999815
633,1/25/17 22:45,Hernando,FL,light,~1 minute,2017-01-25 22:45:00,60.0,2017-01-25 22:46:00,FL Hernando,-82.3745401,28.8999815
634,1/25/17 22:15,Liberty,IN,triangle,5 minutes,2017-01-25 22:15:00,300.0,2017-01-25 22:20:00,IN Liberty,-94.8105955,30.1633593
635,1/25/17 20:45,San Antonio,TX,light,90 minutes,2017-01-25 20:45:00,5400.0,2017-01-25 22:15:00,TX San Antonio,-98.4936282,29.4241219
636,1/25/17 20:00,Desert Hot Springs,CA,sphere,45 minutes,2017-01-25 20:00:00,2700.0,2017-01-25 20:45:00,CA Desert Hot Springs,-116.5016784,33.961124
637,1/25/17 20:00,Germantown,MD,rectangle,~1 minute,2017-01-25 20:00:00,60.0,2017-01-25 20:01:00,MD Germantown,-77.2716502,39.1731621
638,1/25/17 19:25,Compton,CA,light,2 minutes,2017-01-25 19:25:00,120.0,2017-01-25 19:27:00,CA Compton,-118.2200712,33.8958492
639,1/25/17 19:05,Lakehills,TX,formation,15 minutes,2017-01-25 19:05:00,900.0,2017-01-25 19:20:00,TX Lakehills,-98.9430859,29.604672
640,1/25/17 19:00,San Diego,CA,circle,2 hours,2017-01-25 19:00:00,7200.0,2017-01-25 21:00:00,CA San Diego,-117.1610838,32.715738
641,1/25/17 19:00,Yuma,AZ,light,8 minutes,2017-01-25 19:00:00,480.0,2017-01-25 19:08:00,AZ Yuma,-114.6276916,32.6926512
642,1/25/17 18:30,Greensboro,NC,formation,2 minutes,2017-01-25 18:30:00,120.0,2017-01-25 18:32:00,NC Greensboro,-79.8098429,36.0674908
643,1/25/17 18:00,Midlothian,VA,light,5-10 seconds,2017-01-25 18:00:00,10.0,2017-01-25 18:00:10,VA Midlothian,-77.6490005,37.5061069
644,1/25/17 17:45,Sidney,ME,light,10 minutes,2017-01-25 17:45:00,600.0,2017-01-25 17:55:00,ME Sidney,-69.7226248,44.4530868
645,1/25/17 16:45,Belfast,ME,light,3 minutes,2017-01-25 16:45:00,180.0,2017-01-25 16:48:00,ME Belfast,-69.0064234,44.4259092
647,1/24/17 18:30,Minneapolis/Bryn Mawr/ Theodore Wirth Golf Course area,MN,flash,5 seconds,2017-01-24 18:30:00,5.0,2017-01-24 18:30:05,MN Minneapolis/Bryn Mawr/ Theodore Wirth Golf Course area,-93.3239976,44.9865209
649,1/23/17 20:30,Steelville,MO,light,1 hour,2017-01-23 20:30:00,3600.0,2017-01-23 21:30:00,MO Steelville,-91.354868,37.9680999
650,1/23/17 19:30,North Myrtle Beach,SC,formation,10 seconds,2017-01-23 19:30:00,10.0,2017-01-23 19:30:10,SC North Myrtle Beach,-78.680016,33.8160058
651,1/23/17 19:00,Hays,KS,unknown,2 seconds,2017-01-23 19:00:00,2.0,2017-01-23 19:00:02,KS Hays,-99.3267702,38.8791783
652,1/23/17 19:00,Los Lunas,NM,light,90 minutes,2017-01-23 19:00:00,5400.0,2017-01-23 20:30:00,NM Los Lunas,-106.7333599,34.806166
654,1/23/17 06:43,Seattle,WA,sphere,58 minutes,2017-01-23 06:43:00,3480.0,2017-01-23 07:41:00,WA Seattle,-122.3320708,47.6062095
655,1/23/17 03:00,Los Angeles,CA,disk,30 seconds,2017-01-23 03:00:00,30.0,2017-01-23 03:00:30,CA Los Angeles,-118.2436849,34.0522342
656,1/23/17 02:45,Hillsboro,OR,flash,3 minutes,2017-01-23 02:45:00,180.0,2017-01-23 02:48:00,OR Hillsboro,-122.989827,45.5228939
658,1/23/17 00:12,Salinas,CA,light,5-10 minutes,2017-01-23 00:12:00,600.0,2017-01-23 00:22:00,CA Salinas,-121.6555013,36.6777372
659,1/23/17 00:04,Yachats,OR,circle,2 minutes,2017-01-23 00:04:00,120.0,2017-01-23 00:06:00,OR Yachats,-124.1048418,44.3112312
660,1/23/17 00:00,Gila,NM,sphere,90 minutes,2017-01-23 00:00:00,5400.0,2017-01-23 01:30:00,NM Gila,-108.5775687,32.9646574
662,1/22/17 19:00,Rosamond,CA,circle,2+ hours,2017-01-22 19:00:00,7200.0,2017-01-22 21:00:00,CA Rosamond,-118.1634075,34.8641446
663,1/22/17 02:44,Cinnaminson,NJ,chevron,4 minutes,2017-01-22 02:44:00,240.0,2017-01-22 02:48:00,NJ Cinnaminson,-74.9927693,39.9969646
664,1/21/17 20:30,Roswell,NM,light,30 minutes,2017-01-21 20:30:00,1800.0,2017-01-21 21:00:00,NM Roswell,-104.5230242,33.3942655
665,1/21/17 20:30,Gilbert,AZ,light,3 seconds,2017-01-21 20:30:00,3.0,2017-01-21 20:30:03,AZ Gilbert,-111.789027,33.3528264
666,1/21/17 20:00,Senoia,GA,light,20 minutes,2017-01-21 20:00:00,1200.0,2017-01-21 20:20:00,GA Senoia,-84.5538165,33.3023411
667,1/21/17 19:00,Holland,OH,circle,2 minutes,2017-01-21 19:00:00,120.0,2017-01-21 19:02:00,OH Holland,-83.711604,41.621718
668,1/21/17 18:58,Saint Augustine,FL,light,14 minutes,2017-01-21 18:58:00,840.0,2017-01-21 19:12:00,FL Saint Augustine,-81.3124341,29.9012437
669,1/21/17 18:40,Woodbridge,VA,oval,2 minutes,2017-01-21 18:40:00,120.0,2017-01-21 18:42:00,VA Woodbridge,-77.2497049,38.6581722
670,1/21/17 18:40,Holly Hill,FL,sphere,2-4 minutes,2017-01-21 18:40:00,240.0,2017-01-21 18:44:00,FL Holly Hill,-81.0375555,29.2435916
671,1/21/17 05:00,Tulsa,OK,unknown,1.5 hours,2017-01-21 05:00:00,18000.0,2017-01-21 10:00:00,OK Tulsa,-95.992775,36.1539816
672,1/21/17 04:00,Plantation,FL,unknown,60+ minutes,2017-01-21 04:00:00,3600.0,2017-01-21 05:00:00,FL Plantation,-80.2331036,26.1275862
674,1/20/17 20:19,Cocoa,FL,circle,3.30 minutes,2017-01-20 20:19:00,1800.0,2017-01-20 20:49:00,FL Cocoa,-80.7419984,28.3861159
675,1/20/17 20:15,Orlando,FL,sphere,20 minutes,2017-01-20 20:15:00,1200.0,2017-01-20 20:35:00,FL Orlando,-81.3792365,28.5383355
676,1/20/17 19:30,Deland,FL,fireball,~1 minute,2017-01-20 19:30:00,60.0,2017-01-20 19:31:00,FL Deland,-81.3031179,29.028318
677,1/20/17 14:00,Fayetteville,NC,sphere,5 minutes,2017-01-20 14:00:00,300.0,2017-01-20 14:05:00,NC Fayetteville,-78.8783585,35.0526641
679,1/19/17 22:00,Fort Lauderdale,FL,light,5 minutes,2017-01-19 22:00:00,300.0,2017-01-19 22:05:00,FL Fort Lauderdale,-80.1373174,26.1224386
680,1/19/17 21:25,Franklinton,LA,triangle,5 minutes,2017-01-19 21:25:00,300.0,2017-01-19 21:30:00,LA Franklinton,-90.153141,30.8471283
681,1/19/17 20:45,Summerfield,FL,light,45 minutes,2017-01-19 20:45:00,2700.0,2017-01-19 21:30:00,FL Summerfield,-82.0204688,29.0075671
682,1/19/17 19:00,Skillman,NJ,formation,10 minutes ?,2017-01-19 19:00:00,600.0,2017-01-19 19:10:00,NJ Skillman,-74.7146817,40.4201165
683,1/19/17 18:05,Lincoln,NM,fireball,5 minutes,2017-01-19 18:05:00,300.0,2017-01-19 18:10:00,NM Lincoln,-105.3838716,33.4920276
684,1/19/17 18:00,Walnut Creek,CA,circle,20 seconds,2017-01-19 18:00:00,20.0,2017-01-19 18:00:20,CA Walnut Creek,-122.0651819,37.9100783
685,1/19/17 06:10,Long Beach,CA,fireball,1 minute,2017-01-19 06:10:00,60.0,2017-01-19 06:11:00,CA Long Beach,-118.1937395,33.7700504
686,1/19/17 02:28,Minneapolis,MN,cigar,30 minutes,2017-01-19 02:28:00,1800.0,2017-01-19 02:58:00,MN Minneapolis,-93.2650108,44.977753
687,1/18/17 23:30,Fort Collins,CO,chevron,5-10 seconds,2017-01-18 23:30:00,10.0,2017-01-18 23:30:10,CO Fort Collins,-105.084423,40.5852602
688,1/18/17 22:30,Chicago,IL,triangle,30 seconds,2017-01-18 22:30:00,30.0,2017-01-18 22:30:30,IL Chicago,-87.6297982,41.8781136
689,1/18/17 21:50,Truro (Nova Scotia)(Canada),NS,triangle,1-2 minutes,2017-01-18 21:50:00,120.0,2017-01-18 21:52:00,NS Truro (Nova Scotia)(Canada),-63.2869407,45.3657733
690,1/18/17 21:00,Sumter,SC,triangle,15 minutes,2017-01-18 21:00:00,900.0,2017-01-18 21:15:00,SC Sumter,-80.3414693,33.9204354
691,1/18/17 20:28,Brandon,SD,other,35 minutes,2017-01-18 20:28:00,2100.0,2017-01-18 21:03:00,SD Brandon,-96.5719896,43.5946963
692,1/18/17 19:45,Crystal River,FL,light,30 minutes +,2017-01-18 19:45:00,1800.0,2017-01-18 20:15:00,FL Crystal River,-82.5926012,28.902479
693,1/18/17 18:53,River Falls,WI,fireball,15 minutes so far,2017-01-18 18:53:00,900.0,2017-01-18 19:08:00,WI River Falls,-92.6206021,44.8526697
694,1/18/17 17:00,Wilson,NY,circle,60 minutes,2017-01-18 17:00:00,3600.0,2017-01-18 18:00:00,NY Wilson,-78.8156113,43.2613892
695,1/18/17 01:00,New Market,MD,unknown,5 minutes+,2017-01-18 01:00:00,300.0,2017-01-18 01:05:00,MD New Market,-77.2694278,39.3826031
696,1/17/17 21:00,Deltona,FL,light,~5 hours?,2017-01-17 21:00:00,18000.0,2017-01-18 02:00:00,FL Deltona,-81.2636738,28.9005446
697,1/17/17 20:42,Concord,NC,light,20 minutes,2017-01-17 20:42:00,1200.0,2017-01-17 21:02:00,NC Concord,-80.579511,35.4087517
698,1/17/17 20:39,Randall,MN,light,15 minutes+,2017-01-17 20:39:00,900.0,2017-01-17 20:54:00,MN Randall,-94.5036199,46.0910771
699,1/17/17 19:48,Omaha,NE,fireball,3 minutes ?,2017-01-17 19:48:00,180.0,2017-01-17 19:51:00,NE Omaha,-95.9979883,41.2523634
700,1/17/17 19:20,St. George,UT,circle,10 minutes,2017-01-17 19:20:00,600.0,2017-01-17 19:30:00,UT St. George,-113.5684164,37.0965278
701,1/17/17 17:26,Oak Harbor,WA,circle,20 seconds,2017-01-17 17:26:00,20.0,2017-01-17 17:26:20,WA Oak Harbor,-122.6432245,48.2931559
702,1/17/17 16:00,Yucca Valley,CA,disk,5-6 minutes,2017-01-17 16:00:00,360.0,2017-01-17 16:06:00,CA Yucca Valley,-116.432235,34.1141743
703,1/17/17 09:53,Warner,NH,light,5 seconds,2017-01-17 09:53:00,5.0,2017-01-17 09:53:05,NH Warner,-71.8334145,43.2556568
705,1/16/17 19:00,Oxford,MS,circle,30 minutes,2017-01-16 19:00:00,1800.0,2017-01-16 19:30:00,MS Oxford,-89.5192484,34.3664951
706,1/16/17 19:00,Morgan,UT,light,5 minutes,2017-01-16 19:00:00,300.0,2017-01-16 19:05:00,UT Morgan,-111.6768769,41.036056
707,1/16/17 18:41,New Paltz,NY,triangle,30 minutes,2017-01-16 18:41:00,1800.0,2017-01-16 19:11:00,NY New Paltz,-74.085245,41.7385417
708,1/16/17 18:30,Las Vegas,NV,rectangle,4 hours,2017-01-16 18:30:00,14400.0,2017-01-16 22:30:00,NV Las Vegas,-115.1398296,36.1699412
710,1/16/17 17:45,Baltimore,MD,light,30 seconds,2017-01-16 17:45:00,30.0,2017-01-16 17:45:30,MD Baltimore,-76.6121893,39.2903848
711,1/15/17 22:00,San Diego,CA,fireball,15-20 minutes,2017-01-15 22:00:00,1200.0,2017-01-15 22:20:00,CA San Diego,-117.1610838,32.715738
712,1/15/17 20:53,Phoenix,AZ,flash,2 minutes,2017-01-15 20:53:00,120.0,2017-01-15 20:55:00,AZ Phoenix,-112.0740373,33.4483771
714,1/15/17 19:00,Powder Springs,GA,formation,2 minutes,2017-01-15 19:00:00,120.0,2017-01-15 19:02:00,GA Powder Springs,-84.683824,33.8595491
715,1/15/17 17:45,Bridgewater,NJ,unknown,10 minutes,2017-01-15 17:45:00,600.0,2017-01-15 17:55:00,NJ Bridgewater,-74.6049061,40.5939636
716,1/15/17 03:00,Rome,GA,changing,2 hour,2017-01-15 03:00:00,7200.0,2017-01-15 05:00:00,GA Rome,-85.1646726,34.257038
717,1/15/17 01:00,Oak Park,GA,changing,15 seconds,2017-01-15 01:00:00,15.0,2017-01-15 01:00:15,GA Oak Park,-82.3145693,32.3582334
720,1/14/17 21:18,Hudson,FL,sphere,3 minutes,2017-01-14 21:18:00,180.0,2017-01-14 21:21:00,FL Hudson,-82.6934343,28.3644485
721,1/14/17 20:45,Fort Lauderdale,FL,circle,2 minutes,2017-01-14 20:45:00,120.0,2017-01-14 20:47:00,FL Fort Lauderdale,-80.1373174,26.1224386
722,1/14/17 20:35,Edneyville,NC,sphere,20 seconds,2017-01-14 20:35:00,20.0,2017-01-14 20:35:20,NC Edneyville,-82.3234843,35.4311421
723,1/14/17 19:38,Hillsboro,OR,light,3 seconds,2017-01-14 19:38:00,3.0,2017-01-14 19:38:03,OR Hillsboro,-122.989827,45.5228939
724,1/14/17 19:30,Grand Rapids,MI,light,1 hour,2017-01-14 19:30:00,3600.0,2017-01-14 20:30:00,MI Grand Rapids,-85.6680863,42.9633599
725,1/14/17 19:00,Lake Charles,LA,formation,3 minutes,2017-01-14 19:00:00,180.0,2017-01-14 19:03:00,LA Lake Charles,-93.2173758,30.2265949
726,1/14/17 18:00,Santa Rosa,CA,circle,8-10 seconds,2017-01-14 18:00:00,10.0,2017-01-14 18:00:10,CA Santa Rosa,-122.7140548,38.440429
728,1/14/17 17:51,Daytona Beach,FL,fireball,10 minutes,2017-01-14 17:51:00,600.0,2017-01-14 18:01:00,FL Daytona Beach,-81.0228331,29.2108147
729,1/14/17 17:00,Melbourne,FL,light,30 minutes +,2017-01-14 17:00:00,1800.0,2017-01-14 17:30:00,FL Melbourne,-80.6081089,28.0836269
731,1/14/17 13:00,Yerington,NV,circle,~2 seconds,2017-01-14 13:00:00,2.0,2017-01-14 13:00:02,NV Yerington,-119.1629309,38.9857508
732,1/14/17 06:35,Olympia,WA,triangle,3-4 minutes,2017-01-14 06:35:00,240.0,2017-01-14 06:39:00,WA Olympia,-122.9006951,47.0378741
733,1/13/17 22:30,Reynolds,GA,sphere,2 seconds,2017-01-13 22:30:00,2.0,2017-01-13 22:30:02,GA Reynolds,-84.0963004,32.5598685
734,1/13/17 21:40,Dedham,MA,light,10-15 minutes,2017-01-13 21:40:00,900.0,2017-01-13 21:55:00,MA Dedham,-71.1676536,42.2436085
735,1/13/17 21:30,Hilton Head Island,SC,sphere,15 minutes,2017-01-13 21:30:00,900.0,2017-01-13 21:45:00,SC Hilton Head Island,-80.752608,32.216316
736,1/13/17 20:45,Santa Rosa,CA,formation,5 minutes,2017-01-13 20:45:00,300.0,2017-01-13 20:50:00,CA Santa Rosa,-122.7140548,38.440429
737,1/13/17 20:25,Santa Rosa,CA,formation,10 minutes,2017-01-13 20:25:00,600.0,2017-01-13 20:35:00,CA Santa Rosa,-122.7140548,38.440429
738,1/13/17 19:50,San Rafael,NM,triangle,3-4 minutes,2017-01-13 19:50:00,240.0,2017-01-13 19:54:00,NM San Rafael,-107.8826751,35.1125344
739,1/13/17 19:50,Milford,DE,triangle,4 minutes,2017-01-13 19:50:00,240.0,2017-01-13 19:54:00,DE Milford,-75.4279748,38.9126129
740,1/13/17 19:35,Bloomingburg,NY,circle,~6 minutes,2017-01-13 19:35:00,360.0,2017-01-13 19:41:00,NY Bloomingburg,-74.4396014,41.5542603
741,1/13/17 19:25,West Palm Beach,FL,triangle,5 minutes,2017-01-13 19:25:00,300.0,2017-01-13 19:30:00,FL West Palm Beach,-80.0533746,26.7153424
742,1/13/17 12:32,Sandy,UT,other,2 seconds,2017-01-13 12:32:00,2.0,2017-01-13 12:32:02,UT Sandy,-111.8389726,40.5649781
743,1/13/17 06:15,Rumford,RI,light,10 seconds,2017-01-13 06:15:00,10.0,2017-01-13 06:15:10,RI Rumford,-71.3557165,41.8462161
744,1/13/17 03:00,Asheboro,NC,formation,1-2 minutes,2017-01-13 03:00:00,120.0,2017-01-13 03:02:00,NC Asheboro,-79.8136446,35.7079146
746,1/13/17 01:00,Newark,NJ,other,30 minutes,2017-01-13 01:00:00,1800.0,2017-01-13 01:30:00,NJ Newark,-74.1723667,40.735657
747,1/13/17 00:10,Uhland,TX,light,<1 minute,2017-01-13 00:10:00,60.0,2017-01-13 00:11:00,TX Uhland,-97.7861137,29.9577184
748,1/12/17 21:35,Albuquerque,NM,fireball,30 seconds,2017-01-12 21:35:00,30.0,2017-01-12 21:35:30,NM Albuquerque,-106.6055534,35.0853336
750,1/12/17 20:55,Fremont,WI,unknown,5 minutes,2017-01-12 20:55:00,300.0,2017-01-12 21:00:00,WI Fremont,-88.8648344,44.2597027
751,1/12/17 20:00,Troy,NC,cylinder,20 seconds,2017-01-12 20:00:00,20.0,2017-01-12 20:00:20,NC Troy,-79.8944901,35.3584743
752,1/12/17 19:30,Ponce Inlet,FL,changing,2 hours,2017-01-12 19:30:00,7200.0,2017-01-12 21:30:00,FL Ponce Inlet,-80.9369983,29.0963729
753,1/12/17 19:30,Tarpon Springs,FL,triangle,3 minutes,2017-01-12 19:30:00,180.0,2017-01-12 19:33:00,FL Tarpon Springs,-82.7567679,28.1461248
754,1/12/17 18:45,New York City (Brooklyn),NY,cigar,8 minutes,2017-01-12 18:45:00,480.0,2017-01-12 18:53:00,NY New York City (Brooklyn),-73.9441579,40.6781784
755,1/12/17 08:40,Myrtle Beach,SC,light,10 seconds,2017-01-12 08:40:00,10.0,2017-01-12 08:40:10,SC Myrtle Beach,-78.8866943,33.6890603
757,1/11/17 23:45,Midvale,UT,flash,3-4 seconds,2017-01-11 23:45:00,4.0,2017-01-11 23:45:04,UT Midvale,-111.8999353,40.6110589
758,1/11/17 21:00,Franklinton,NC,other,3 minutes,2017-01-11 21:00:00,180.0,2017-01-11 21:03:00,NC Franklinton,-78.4580543,36.1018163
760,1/11/17 20:45,Castle Rock,CO,sphere,~1 minute,2017-01-11 20:45:00,60.0,2017-01-11 20:46:00,CO Castle Rock,-104.8560902,39.3722121
761,1/11/17 20:05,Shelton,WA,fireball,2 seconds,2017-01-11 20:05:00,2.0,2017-01-11 20:05:02,WA Shelton,-123.1007066,47.2150945
762,1/11/17 18:40,Hays (5 miles east of; on I-70),KS,other,30 seconds,2017-01-11 18:40:00,30.0,2017-01-11 18:40:30,KS Hays (5 miles east of; on I-70),-99.314754,38.898004
763,1/11/17 18:22,Hinesville,GA,disk,30 minutes,2017-01-11 18:22:00,1800.0,2017-01-11 18:52:00,GA Hinesville,-81.5959453,31.846877
764,1/11/17 17:40,Chester,NY,oval,10 minutes,2017-01-11 17:40:00,600.0,2017-01-11 17:50:00,NY Chester,-74.2712613,41.3625937
765,1/11/17 17:01,Amherst,MA,unknown,<30 seconds,2017-01-11 17:01:00,30.0,2017-01-11 17:01:30,MA Amherst,-72.5198537,42.3732216
766,1/11/17 08:30,West Newbury,MA,disk,1 hour,2017-01-11 08:30:00,3600.0,2017-01-11 09:30:00,MA West Newbury,-70.989778,42.8014795
767,1/11/17 06:30,Madison,MS,unknown,15-20 minutes,2017-01-11 06:30:00,1200.0,2017-01-11 06:50:00,MS Madison,-90.1153638,32.4618086
768,1/10/17 21:40,Hemingway,SC,egg,<1 minute,2017-01-10 21:40:00,60.0,2017-01-10 21:41:00,SC Hemingway,-79.4475566,33.7537774
769,1/10/17 19:30,North Port,FL,sphere,15 seconds,2017-01-10 19:30:00,15.0,2017-01-10 19:30:15,FL North Port,-82.2359254,27.044224
772,1/10/17 06:02,Magdalena,NM,formation,30 seconds,2017-01-10 06:02:00,30.0,2017-01-10 06:02:30,NM Magdalena,-107.2439251,34.1167305
773,1/10/17 06:00,Mountainair,NM,formation,30 seconds,2017-01-10 06:00:00,30.0,2017-01-10 06:00:30,NM Mountainair,-106.241127,34.5203411
774,1/10/17 03:45,Sahaurita,AZ,light,20 minutes,2017-01-10 03:45:00,1200.0,2017-01-10 04:05:00,AZ Sahaurita,-110.955646,31.9575818
775,1/9/17 23:00,Orlando,FL,circle,30 minutes,2017-01-09 23:00:00,1800.0,2017-01-09 23:30:00,FL Orlando,-81.3792365,28.5383355
776,1/9/17 20:50,Holiday,FL,triangle,15-60 seconds,2017-01-09 20:50:00,60.0,2017-01-09 20:51:00,FL Holiday,-82.7395454,28.18779
777,1/9/17 19:30,Roanoke,VA,other,3-5 minutes,2017-01-09 19:30:00,300.0,2017-01-09 19:35:00,VA Roanoke,-79.9414266,37.2709704
778,1/9/17 19:15,Chandler,AZ,sphere,2 minutes,2017-01-09 19:15:00,120.0,2017-01-09 19:17:00,AZ Chandler,-111.8412502,33.3061605
779,1/9/17 18:00,Gouldsboro,PA,triangle,1 hour,2017-01-09 18:00:00,3600.0,2017-01-09 19:00:00,PA Gouldsboro,-75.4560183,41.2445293
780,1/9/17 07:05,Issaquah,WA,triangle,~4 minutes,2017-01-09 07:05:00,240.0,2017-01-09 07:09:00,WA Issaquah,-122.0326191,47.5301011
781,1/9/17 05:05,Zephyrhills,FL,circle,10 minutes,2017-01-09 05:05:00,600.0,2017-01-09 05:15:00,FL Zephyrhills,-82.1811947,28.2336196
783,1/9/17 03:02,Birmingham,AL,changing,5 minutes,2017-01-09 03:02:00,300.0,2017-01-09 03:07:00,AL Birmingham,-86.80249,33.5206608
784,1/8/17 21:58,Palm Coast,FL,oval,3 seconds,2017-01-08 21:58:00,3.0,2017-01-08 21:58:03,FL Palm Coast,-81.2078699,29.5844524
785,1/8/17 21:10,Valrico,FL,changing,~3 hours,2017-01-08 21:10:00,10800.0,2017-01-09 00:10:00,FL Valrico,-82.2420317,27.9462615
786,1/8/17 19:15,Bealeton,VA,other,2 hours,2017-01-08 19:15:00,7200.0,2017-01-08 21:15:00,VA Bealeton,-77.767773,38.5830443
787,1/8/17 19:00,Wabasha,MN,triangle,1 hour,2017-01-08 19:00:00,3600.0,2017-01-08 20:00:00,MN Wabasha,-92.0382346,44.3710051
788,1/8/17 17:30,Highland,CA,light,10-15 minutes,2017-01-08 17:30:00,900.0,2017-01-08 17:45:00,CA Highland,-117.2086513,34.1283442
790,1/8/17 06:30,Southfield,MI,light,15 seconds,2017-01-08 06:30:00,15.0,2017-01-08 06:30:15,MI Southfield,-83.2218731,42.4733688
791,1/8/17 06:20,Waterford,MI,cone,30 seconds,2017-01-08 06:20:00,30.0,2017-01-08 06:20:30,MI Waterford,-83.4066132,42.6907443
792,1/8/17 03:30,Macfarland,WI,sphere,20-50 seconds,2017-01-08 03:30:00,50.0,2017-01-08 03:30:50,WI Macfarland,-89.2898397,43.0124984
793,1/8/17 03:00,Golden,CO,unknown,2.5 hours,2017-01-08 03:00:00,18000.0,2017-01-08 08:00:00,CO Golden,-105.2210997,39.755543
795,1/8/17 02:18,Ball Ground,GA,light,45 minutes,2017-01-08 02:18:00,2700.0,2017-01-08 03:03:00,GA Ball Ground,-84.3779515,34.3372664
796,1/7/17 23:20,Sutherlin,OR,fireball,5 minutes,2017-01-07 23:20:00,300.0,2017-01-07 23:25:00,OR Sutherlin,-123.3125763,43.3901177
798,1/7/17 21:50,Conception Bay South (Canada),NF,fireball,5 minutes,2017-01-07 21:50:00,300.0,2017-01-07 21:55:00,NF Conception Bay South (Canada),-52.9940605,47.5083178
799,1/7/17 21:30,Newcastle,DE,teardrop,5 seconds,2017-01-07 21:30:00,5.0,2017-01-07 21:30:05,DE Newcastle,-75.5668166,39.6620397
800,1/7/17 21:15,Hardyston Township,NJ,unknown,1-2 minutes,2017-01-07 21:15:00,120.0,2017-01-07 21:17:00,NJ Hardyston Township,-74.5540506,41.1137037
801,1/7/17 21:00,Shepherd,MI,circle,1 hour,2017-01-07 21:00:00,3600.0,2017-01-07 22:00:00,MI Shepherd,-84.6947325,43.5244747
802,1/7/17 20:15,Antelope Valley,CA,formation,3-8 minutes,2017-01-07 20:15:00,480.0,2017-01-07 20:23:00,CA Antelope Valley,-118.2522977,34.7513712
803,1/7/17 20:10,New Berlin,WI,light,3 seconds,2017-01-07 20:10:00,3.0,2017-01-07 20:10:03,WI New Berlin,-88.1084224,42.9764027
804,1/7/17 20:00,Centerview,OK,sphere,20 minutes,2017-01-07 20:00:00,1200.0,2017-01-07 20:20:00,OK Centerview,-96.6652947,35.4336825
805,1/7/17 19:30,Nashville,TN,fireball,1 minute,2017-01-07 19:30:00,60.0,2017-01-07 19:31:00,TN Nashville,-86.7816016,36.1626638
806,1/7/17 19:30,Las Vegas,NV,sphere,10 seconds,2017-01-07 19:30:00,10.0,2017-01-07 19:30:10,NV Las Vegas,-115.1398296,36.1699412
808,1/7/17 19:00,Denver,CO,light,10 minutes,2017-01-07 19:00:00,600.0,2017-01-07 19:10:00,CO Denver,-104.990251,39.7392358
809,1/7/17 18:15,Hendersonville,NC,light,7 minutes,2017-01-07 18:15:00,420.0,2017-01-07 18:22:00,NC Hendersonville,-82.4609528,35.3187279
810,1/6/17 23:00,Bellingham,WA,triangle,3 minutes,2017-01-06 23:00:00,180.0,2017-01-06 23:03:00,WA Bellingham,-122.4786854,48.7519112
812,1/6/17 20:00,Loudon,TN,oval,4-5 minutes,2017-01-06 20:00:00,300.0,2017-01-06 20:05:00,TN Loudon,-84.3338112,35.7328541
813,1/6/17 19:15,Merced,CA,light,5 minutes,2017-01-06 19:15:00,300.0,2017-01-06 19:20:00,CA Merced,-120.4829677,37.3021632
814,1/6/17 19:05,Kalama,WA,circle,2 minutes,2017-01-06 19:05:00,120.0,2017-01-06 19:07:00,WA Kalama,-122.8445509,46.0084472
815,1/6/17 19:00,San Anselmo,CA,formation,25 minutes,2017-01-06 19:00:00,1500.0,2017-01-06 19:25:00,CA San Anselmo,-122.5616448,37.9746458
817,1/6/17 18:24,Tigard,OR,circle,1 hour,2017-01-06 18:24:00,3600.0,2017-01-06 19:24:00,OR Tigard,-122.7714861,45.4312294
818,1/6/17 17:30,Austin,TX,formation,5 minutes,2017-01-06 17:30:00,300.0,2017-01-06 17:35:00,TX Austin,-97.7430608,30.267153
819,1/5/17 22:15,Sandy,UT,fireball,7 minutes,2017-01-05 22:15:00,420.0,2017-01-05 22:22:00,UT Sandy,-111.8389726,40.5649781
821,1/5/17 06:35,Rochester,NY,formation,5 minutes,2017-01-05 06:35:00,300.0,2017-01-05 06:40:00,NY Rochester,-77.6109219,43.16103
822,1/4/17 21:34,Parkland,WA,circle,1 hour,2017-01-04 21:34:00,3600.0,2017-01-04 22:34:00,WA Parkland,-122.4340113,47.1553769
823,1/4/17 19:20,Port Angeles,WA,light,5 minutes,2017-01-04 19:20:00,300.0,2017-01-04 19:25:00,WA Port Angeles,-123.4307413,48.118146
824,1/4/17 17:00,West Deptford,NJ,other,30 seconds,2017-01-04 17:00:00,30.0,2017-01-04 17:00:30,NJ West Deptford,-75.1895576,39.8318378
825,1/4/17 13:00,Davenport,CA,formation,30 minutes,2017-01-04 13:00:00,1800.0,2017-01-04 13:30:00,CA Davenport,-122.1966597,37.0135208
826,1/3/17 05:19,University Place,WA,chevron,7 minutes,2017-01-03 05:19:00,420.0,2017-01-03 05:26:00,WA University Place,-122.5504041,47.2356536
828,1/2/17 20:00,Corona,CA,fireball,3 minutes,2017-01-02 20:00:00,180.0,2017-01-02 20:03:00,CA Corona,-117.5664384,33.8752935
830,1/2/17,Thousand Oaks,CA,triangle,6 minutes,2017-01-02 00:00:00,360.0,2017-01-02 00:06:00,CA Thousand Oaks,-118.8375937,34.1705609
831,1/1/17 00:00,Halethorpe,MD,unknown,1 minute,2017-01-01 00:00:00,60.0,2017-01-01 00:01:00,MD Halethorpe,-76.6806441,39.2401735
836,1/1/17 19:31,Decatur,MI,light,2 seconds,2017-01-01 19:31:00,2.0,2017-01-01 19:31:02,MI Decatur,-85.9744569,42.1080979
837,1/1/17 19:05,Owings Mills,MD,circle,15 minutes,2017-01-01 19:05:00,900.0,2017-01-01 19:20:00,MD Owings Mills,-76.7802528,39.4195499
838,1/1/17 19:00,Bear,DE,light,4-5 minutes,2017-01-01 19:00:00,300.0,2017-01-01 19:05:00,DE Bear,-95.4888653,35.268949
840,1/1/17 18:15,Coronado,CA,light,15 minutes,2017-01-01 18:15:00,900.0,2017-01-01 18:30:00,CA Coronado,-117.1830891,32.6858853
842,1/1/17 14:02,Oshawa (Canada),ON,cigar,6 minutes,2017-01-01 14:02:00,360.0,2017-01-01 14:08:00,ON Oshawa (Canada),-78.8657912,43.8970929
843,1/1/17 13:50,Colorado Springs,CO,sphere,<1 minute,2017-01-01 13:50:00,60.0,2017-01-01 13:51:00,CO Colorado Springs,-104.8213634,38.8338816
845,1/1/17 12:05,Boise,ID,circle,10 minutes,2017-01-01 12:05:00,600.0,2017-01-01 12:15:00,ID Boise,-116.2146068,43.6187102
846,1/1/17 02:30,Galt,CA,circle,8 seconds,2017-01-01 02:30:00,8.0,2017-01-01 02:30:08,CA Galt,-121.2999485,38.2546373
847,1/1/17 02:30,Galt,CA,circle,8 seconds,2017-01-01 02:30:00,8.0,2017-01-01 02:30:08,CA Galt,-121.2999485,38.2546373
848,1/1/17 01:15,Cody,WY,fireball,1-2 seconds,2017-01-01 01:15:00,2.0,2017-01-01 01:15:02,WY Cody,-109.0565308,44.5263422
849,1/1/17 01:00,Placida,FL,cigar,1 minutes,2017-01-01 01:00:00,60.0,2017-01-01 01:01:00,FL Placida,-82.2624037,26.8339094
850,1/1/17 00:30,Pbg,FL,fireball,25 minutes,2017-01-01 00:30:00,1500.0,2017-01-01 00:55:00,FL Pbg,-80.1386547,26.8233946
851,1/1/17 00:30,San Antonio,TX,fireball,2 minutes,2017-01-01 00:30:00,120.0,2017-01-01 00:32:00,TX San Antonio,-98.4936282,29.4241219
852,1/1/17 00:20,San Tan Valley,AZ,fireball,5 minutes,2017-01-01 00:20:00,300.0,2017-01-01 00:25:00,AZ San Tan Valley,-111.5468301,33.177294
854,1/1/17 00:15,Longmont,CO,circle,4 minutes,2017-01-01 00:15:00,240.0,2017-01-01 00:19:00,CO Longmont,-105.1019275,40.1672068
855,1/1/17 00:15,Hope Mills,NC,light,30 minutes,2017-01-01 00:15:00,1800.0,2017-01-01 00:45:00,NC Hope Mills,-78.9453056,34.9704419
856,1/1/17 00:10,Casselberry,FL,sphere,10 minutes,2017-01-01 00:10:00,600.0,2017-01-01 00:20:00,FL Casselberry,-81.3278455,28.677775
857,1/1/17 00:10,Boise,ID,light,15 minutes,2017-01-01 00:10:00,900.0,2017-01-01 00:25:00,ID Boise,-116.2146068,43.6187102
858,1/1/17 00:10,Anchorage,AK,formation,3 minutes,2017-01-01 00:10:00,180.0,2017-01-01 00:13:00,AK Anchorage,-149.9002778,61.2180556
859,1/1/17 00:07,Jacksonville,FL,light,2-3 minutes,2017-01-01 00:07:00,180.0,2017-01-01 00:10:00,FL Jacksonville,-81.655651,30.3321838
860,1/1/17 00:05,Rancho Cordova,CA,egg,5 minutes,2017-01-01 00:05:00,300.0,2017-01-01 00:10:00,CA Rancho Cordova,-121.302728,38.5890723
861,1/1/17 00:01,San Jose,CA,triangle,20 seconds,2017-01-01 00:01:00,20.0,2017-01-01 00:01:20,CA San Jose,-121.8863286,37.3382082
862,1/1/17 00:00,Indianapolis,IN,fireball,10 minutes,2017-01-01 00:00:00,600.0,2017-01-01 00:10:00,IN Indianapolis,-86.158068,39.768403
864,12/31/16 23:56,Phoenix,AZ,triangle,2 minutes,2016-12-31 23:56:00,120.0,2016-12-31 23:58:00,AZ Phoenix,-112.0740373,33.4483771
865,12/31/16 23:50,Anchorage,AK,fireball,20 minutes,2016-12-31 23:50:00,1200.0,2017-01-01 00:10:00,AK Anchorage,-149.9002778,61.2180556
866,12/31/16 23:45,Wasilla,AK,oval,3 minutes,2016-12-31 23:45:00,180.0,2016-12-31 23:48:00,AK Wasilla,-149.4394444,61.5813889
867,12/31/16 23:35,Schaumburg,IL,light,4 minutes,2016-12-31 23:35:00,240.0,2016-12-31 23:39:00,IL Schaumburg,-88.0834059,42.0333607
868,12/31/16 23:33,North Port,FL,sphere,6 minutes,2016-12-31 23:33:00,360.0,2016-12-31 23:39:00,FL North Port,-82.2359254,27.044224
869,12/31/16 23:00,Northglenn,CO,fireball,10 seconds,2016-12-31 23:00:00,10.0,2016-12-31 23:00:10,CO Northglenn,-104.9811468,39.8961821
870,12/31/16 23:00,Santa Cruz,CA,light,15 minutes,2016-12-31 23:00:00,900.0,2016-12-31 23:15:00,CA Santa Cruz,-122.0307963,36.9741171
871,12/31/16 23:00,Satellite Beach,FL,circle,2 hours,2016-12-31 23:00:00,7200.0,2017-01-01 01:00:00,FL Satellite Beach,-80.5900519,28.1761233
872,12/31/16 23:00,Campbell,CA,triangle,5 minutes,2016-12-31 23:00:00,300.0,2016-12-31 23:05:00,CA Campbell,-121.9499568,37.2871651
874,12/31/16 23:00,Saint George,UT,light,45 seconds,2016-12-31 23:00:00,45.0,2016-12-31 23:00:45,UT Saint George,-113.5684164,37.0965278
875,12/31/16 22:59,Coeur d'Alene,ID,fireball,1.5 minutes,2016-12-31 22:59:00,300.0,2016-12-31 23:04:00,ID Coeur d'Alene,-116.7804664,47.6776832
877,12/31/16 22:36,Boise,ID,circle,5 minutes,2016-12-31 22:36:00,300.0,2016-12-31 22:41:00,ID Boise,-116.2146068,43.6187102
878,12/31/16 22:24,Indialantic,FL,formation,3-4 minutes,2016-12-31 22:24:00,240.0,2016-12-31 22:28:00,FL Indialantic,-80.5656079,28.0894599
880,12/31/16 22:00,Hallam,PA,circle,3-4 minutes,2016-12-31 22:00:00,240.0,2016-12-31 22:04:00,PA Hallam,-76.6041322,40.00482
882,12/31/16 20:00,Green Bay,WI,light,1+ hours,2016-12-31 20:00:00,3600.0,2016-12-31 21:00:00,WI Green Bay,-88.019826,44.519159
883,12/31/16 20:00,Redmond,OR,sphere,4 hours,2016-12-31 20:00:00,14400.0,2017-01-01 00:00:00,OR Redmond,-121.1739212,44.2726203
884,12/31/16 19:41,Lutz,FL,formation,20 seconds,2016-12-31 19:41:00,20.0,2016-12-31 19:41:20,FL Lutz,-82.4614831,28.1511243
885,12/31/16 19:00,Victor,MT,sphere,10 minutes,2016-12-31 19:00:00,600.0,2016-12-31 19:10:00,MT Victor,-86.3958663,36.9786395
887,12/31/16 17:00,Mesa,AZ,egg,20 minutes,2016-12-31 17:00:00,1200.0,2016-12-31 17:20:00,AZ Mesa,-111.8314724,33.4151843
888,12/31/16 11:10,Eugene,OR,diamond,10 minutes,2016-12-31 11:10:00,600.0,2016-12-31 11:20:00,OR Eugene,-123.0867536,44.0520691
890,12/31/16 09:50,Arvada,CO,unknown,3 seconds,2016-12-31 09:50:00,3.0,2016-12-31 09:50:03,CO Arvada,-105.0874842,39.8027644
891,12/31/16 09:20,Santa Fe,NM,fireball,20 seconds,2016-12-31 09:20:00,20.0,2016-12-31 09:20:20,NM Santa Fe,-105.937799,35.6869752
892,12/31/16 02:45,Phoenix,AZ,flash,5-10 seconds,2016-12-31 02:45:00,10.0,2016-12-31 02:45:10,AZ Phoenix,-112.0740373,33.4483771
894,12/31/16 01:32,Novato,CA,changing,1-2 minutes,2016-12-31 01:32:00,120.0,2016-12-31 01:34:00,CA Novato,-122.5697032,38.1074198
895,12/31/16 00:30,Burlington,NJ,circle,15 minutes,2016-12-31 00:30:00,900.0,2016-12-31 00:45:00,NJ Burlington,-74.8648873,40.071222
896,12/31/16 00:30,Cleburne,TX,oval,2 hours,2016-12-31 00:30:00,7200.0,2016-12-31 02:30:00,TX Cleburne,-97.3866837,32.3476438
897,12/31/16 00:00,Turner,KS,unknown,60 seconds,2016-12-31 00:00:00,60.0,2016-12-31 00:01:00,KS Turner,-94.70189,39.0650304
899,12/30/16 21:40,Spring Hill,FL,cylinder,>2 minutes,2016-12-30 21:40:00,120.0,2016-12-30 21:42:00,FL Spring Hill,-82.5369872,28.4831682
900,12/30/16 20:30,Newport Beach,CA,light,3 minutes,2016-12-30 20:30:00,180.0,2016-12-30 20:33:00,CA Newport Beach,-117.9289469,33.6189101
901,12/30/16 20:00,New River,AZ,fireball,3 minutes,2016-12-30 20:00:00,180.0,2016-12-30 20:03:00,AZ New River,-112.1359906,33.9158687
902,12/30/16 20:00,Miss Point,MS,unknown,15 minutes,2016-12-30 20:00:00,900.0,2016-12-30 20:15:00,MS Miss Point,-88.5344601,30.4115881
903,12/30/16 18:42,Gresham,OR,light,1 hour,2016-12-30 18:42:00,3600.0,2016-12-30 19:42:00,OR Gresham,-122.4302013,45.5001357
904,12/30/16 18:30,San Antonio,TX,fireball,10 minutes,2016-12-30 18:30:00,600.0,2016-12-30 18:40:00,TX San Antonio,-98.4936282,29.4241219
905,12/30/16 15:55,Richland,WA,triangle,2 minutes,2016-12-30 15:55:00,120.0,2016-12-30 15:57:00,WA Richland,-119.2844621,46.2856907
906,12/30/16 14:42,Huntsville,AL,formation,15 minutes,2016-12-30 14:42:00,900.0,2016-12-30 14:57:00,AL Huntsville,-86.5861037,34.7303688
907,12/30/16 02:39,Providence,RI,light,10 minutes,2016-12-30 02:39:00,600.0,2016-12-30 02:49:00,RI Providence,-71.4128343,41.8239891
910,12/30/16 01:30,Toronto (Canada),ON,light,5 minutes,2016-12-30 01:30:00,300.0,2016-12-30 01:35:00,ON Toronto (Canada),-79.3831843,43.653226
911,12/30/16 01:01,Indianapolis,IN,diamond,51 minutes,2016-12-30 01:01:00,3060.0,2016-12-30 01:52:00,IN Indianapolis,-86.158068,39.768403
912,12/29/16 22:23,North Las Vegas,NV,light,2-3 minutes,2016-12-29 22:23:00,180.0,2016-12-29 22:26:00,NV North Las Vegas,-115.1175013,36.1988592
913,12/29/16 22:23,North Las Vegas,NV,light,2-3 minutes,2016-12-29 22:23:00,180.0,2016-12-29 22:26:00,NV North Las Vegas,-115.1175013,36.1988592
914,12/29/16 22:00,Hartselle,AL,triangle,2 hours,2016-12-29 22:00:00,7200.0,2016-12-30 00:00:00,AL Hartselle,-86.9352842,34.4434282
915,12/29/16 21:30,Davenport,WA,fireball,3 minutes,2016-12-29 21:30:00,180.0,2016-12-29 21:33:00,WA Davenport,-118.149973,47.6540456
916,12/29/16 21:30,Davenport,WA,unknown,3 minutes,2016-12-29 21:30:00,180.0,2016-12-29 21:33:00,WA Davenport,-118.149973,47.6540456
917,12/29/16 21:30,Davenport,WA,unknown,3 minutes,2016-12-29 21:30:00,180.0,2016-12-29 21:33:00,WA Davenport,-118.149973,47.6540456
918,12/29/16 20:40,Delray Beach,FL,egg,5 seconds,2016-12-29 20:40:00,5.0,2016-12-29 20:40:05,FL Delray Beach,-80.0728201,26.4614625
919,12/29/16 20:00,El Monte,CA,circle,15 minutes,2016-12-29 20:00:00,900.0,2016-12-29 20:15:00,CA El Monte,-118.0275667,34.0686206
920,12/29/16 20:00,North Dartmouth,MA,other,30 seconds,2016-12-29 20:00:00,30.0,2016-12-29 20:00:30,MA North Dartmouth,-70.9694555,41.640396
921,12/29/16 20:00,Patterson,LA,circle,10 minutes,2016-12-29 20:00:00,600.0,2016-12-29 20:10:00,LA Patterson,-91.3020502,29.6932641
922,12/29/16 20:00,Dillon,SC,chevron,4 hours,2016-12-29 20:00:00,14400.0,2016-12-30 00:00:00,SC Dillon,-79.3711579,34.4165505
924,12/29/16 12:54,Templeton,CA,rectangle,4-10 seconds,2016-12-29 12:54:00,10.0,2016-12-29 12:54:10,CA Templeton,-120.7060049,35.5496939
925,12/29/16 07:00,Davie (heading to Hollywood/Ft. Lauderdale),FL,formation,1-3 minutes,2016-12-29 07:00:00,180.0,2016-12-29 07:03:00,FL Davie (heading to Hollywood/Ft. Lauderdale),-80.3356858,26.0727445
926,12/29/16 06:00,Elkhorn,WI,triangle,5 minutes,2016-12-29 06:00:00,300.0,2016-12-29 06:05:00,WI Elkhorn,-88.5445447,42.6727927
927,12/28/16 22:00,Eugene,OR,sphere,5 seconds,2016-12-28 22:00:00,5.0,2016-12-28 22:00:05,OR Eugene,-123.0867536,44.0520691
928,12/28/16 21:01,Fredericksburg,VA,cylinder,15 minutes,2016-12-28 21:01:00,900.0,2016-12-28 21:16:00,VA Fredericksburg,-77.4605399,38.3031837
929,12/28/16 19:20,Elkton,MD,light,5-10 minutes,2016-12-28 19:20:00,600.0,2016-12-28 19:30:00,MD Elkton,-75.8332718,39.6067789
930,12/28/16 19:00,Spring Lake (Canada),AB,triangle,5 minutes,2016-12-28 19:00:00,300.0,2016-12-28 19:05:00,AB Spring Lake (Canada),-114.140764,53.5183838
931,12/28/16 18:00,Rosamond,CA,circle,45 minutes,2016-12-28 18:00:00,2700.0,2016-12-28 18:45:00,CA Rosamond,-118.1634075,34.8641446
932,12/28/16 17:00,Marlborough,MA,triangle,2 minutes,2016-12-28 17:00:00,120.0,2016-12-28 17:02:00,MA Marlborough,-71.5522874,42.3459271
933,12/28/16 15:40,Jewett City,CT,light,50 minutes,2016-12-28 15:40:00,3000.0,2016-12-28 16:30:00,CT Jewett City,-71.980908,41.606765
935,12/28/16 08:30,Millers Creek,NC,other,5 minutes,2016-12-28 08:30:00,300.0,2016-12-28 08:35:00,NC Millers Creek,-81.2375889,36.1892978
936,12/28/16 05:00,Multiple,IL,light,2 hours,2016-12-28 05:00:00,7200.0,2016-12-28 07:00:00,IL Multiple,-87.6492833,41.8828596
937,12/28/16 04:30,Aiken,SC,light,3 seconds,2016-12-28 04:30:00,3.0,2016-12-28 04:30:03,SC Aiken,-81.7680787,33.5740837
938,12/27/16 21:30,Las Vegas,NV,other,1-2 minutes,2016-12-27 21:30:00,120.0,2016-12-27 21:32:00,NV Las Vegas,-115.1398296,36.1699412
